,ticker,title,link,articleInfo
66,TSLA,These Travel Cards Could Get You On Your Way To A Vacation,https://a.beap.gemini.yahoo.com/mbclk?bv=3.0.0&es=AQAAAKDF4XCXB250nXTK0cUl3qsFgs2jIdgGav_og1A8Mwt902FCeyTuPH7VvV2jUc0EEmgSWbBpqJQ1D0E94rut_UfGXXCPLIMErzeP_HvEagKdkGuQ974cH0T10lNby4eKpJBdCMr7t9DabbDuUhXTPP8YzY9RX4yUB2AX3g4QvWZuhtiIVXaFLP4GyX4IODG3HQvLc_KIli_VPTsZUSCjpvRDXShGj0dkG3ToKzatFsS3EB6lb7GCVToiOHdC1DoSrgH-2CLbowM_WTSjbbf1diumh1gvOCUzoL7UEPUQGwCO2SENUtIedOHkMRnAJ7WAVgD_TXqif4wf02Ch-wKVxI0zIurU5pZ4eKBtgl5G5SI9b44a1DdYNCO43A4fg0jgFHKX4sqhS7xE8fbKWvOHnJfzGIYwjOPwbdTzw_lYPfEB-Zz0U7JFaO-T_iR32SQSlUBaqF-oQ2VlfDsznRdeXHtX_pSUT-n4PDghLh_5RXOLUaOxjoOCMD6IkNrbn4J9Y5yu1NYtsDTrpArjxfmO4m7iVO0r7YV6Qtr_Q0YLYCXe49hRiGxlhkn2bAzKSHrp8Sfr5p31m064xKgNc9347z2obr5yduQXrib9KyGibwRx_fgveD5sZwRG8I_i_Y0M7fj5B8Srqu7g0ZvTB_nwc1f4pPdL2HmqyI0ZbQf4BWOoX8sD3wE9NVvE1KSLcDDlDBtmJs1d6qUj-sEH2YEFIxze-6YxTE1OrXgHJkOZkBitXfbNMCBq9gMwfci42igBXQ7MTPE6BJ9DtLhv9VeDwqTuZXZ_Q8j4KMm69HRd8PlKAnzhuZkYbD4hTuNTHX9jAkZXEazToAosZDJhWDaLlhW8KbGG5Tswmr3LULsyR8JHeqA4UumrAB53MlrIbl0GoRw9sSD13H87pL1d2QL4cCKfW1Xy25zG-OVJXNehvl6uKELXUf4xraeCklaK8MEieW104gPPy8V6Bj-RfuKu-lAoiH5bRfOQim32cIObbnzXfADexRAt0RRRhnLPMEdGPd9FYKmrxmbo0gLcIjMF92Fb8FLTY99b_cR3jnISLN16Si_8oz4XJdOicc5Vj0wxxeEUjSpyZi1vpzzKeC66kdj2cAVPvMZXvvkRf1MtxtnKOIIDTbwc2wwqK_ZxvvcTVNJZ7e9HGDsxs7oEBZRee8ZDHtyLP-bGXhAEO_wZQ3Rzh7hVVfVQcDl1iAoGXoum_R4aNkhdT6W7OzjH1tm1VRtDfieGCPWWBWxBj6Tm4Rgp3Vk-frxDLbhtCckL8nooO12ldmQV8jUH433XbMxVat1MkVs1i0TgC6_MNwq9r_lVTsT9HzqUo3wBVqdRDIveyg33DVD0KDOgBHShh6TlX9vHCchvyTX5pLw--iBV3KQtTh1fNwEMH0985fTWm5VzVd5haFiZ9KCaZl9V1nikTKm4Ibl95FjdKFx4Pc8694wlGeoA8bD6hP8Fcd9OafPOItOewE-ED8Ms9y3zFwI3EZzC2h-X-4ER1tKpiIZEiL2RjAJQr0Wm-D4K60UvOSNHCziWgGgqQip50snEOFnTgsWPxpX7TLkSCvuzMmJkmWeHjKTE7rwBsArVQDRGGK4hyrBugKAQJWTtcgNcXzenMixOSjQXNPwkhjNFP2vQuhWu1thI55XWSirgHJXkcrKf--a9oCp1k7Lg_sGt8bbF7nmemABKYXbPWKxxgcR8x-tbuHifudJ3P-i0TViggyPkZCa0W3ZPWIptnyxUxk6gDwJyLkRVnYIhiuebjA_V9HcPNi9hpGftdX5fJ4E96DYWhEsgoTlHHokBN9e6gJnCDOY9ZZZ5_m7laqQDc8W58pTqT4LQlrO94JaIyJ2qltjMT35qtlbspOuDv6vFBrpM--Id1AmVG13UVaN2k4XP9cB5DjQWeRmF0NG6JBy1CvWDOT_QYpPIXg6aE1TDYOOrWiqm5Mb4GKrEZECzQW7ondxp_eKxCfxfGQrrr-ug5h6iL1XF2jXuiUXsxrF4u5fJe7EfWPi0jcFIMcaWDgZ2pT6nTfle0lJHHoW_qEPsgFVPGcNqexQ2tUFusU0IMahlWGlfmEPkDuyD1aR0JAdd_wVmaiypf4tBrKyZLSpHsNnEl9AayHpY7ZuwJDhbHaY2aLKHfU-zWwXb_kufAuA-T_dvBAQxar3zxc11y8LWXIkPrFqymrDdHmieVIvcJKrzUcwAsozX1V8in0hmiQv5qR4gD56jaWDa8IBduMbkvcf72Ao3RHiY3RdgaEMhyti93YkQrO55YMXJ7f7Q0gQC1ZPp2AQGWcEVaSP987N5xeN6PcNQZchCHCM7SGPEWlyRcoEj19LidbVSn2Nd_FZAcdNJWl_9AbIIH2yRLOA0If5KF9HWPanspCxYwPmaEJqJi4wEZHvYqbNZOhukPdUs9tujoQCZRLYdxTr_csnhfdL-Omrg-Sv9f-gf_OK-ywHmMLSttaKjD3RaHQdFZsdiMevVpMnflap4pQG6Vl-32_yH30WL6nWenwMkha8Ua38a6JxT8YNE0hqhhiyT8UP5G4h9jyTNttDr9bLo-KADbZZoX9-GOsXfWKHrlSm_9a2NLpGRLA7TxZ_iR8Mj_GxwAAhYoNpqa7jwLyLndwDTbt0Kqbwr8uryq1QE6RybqLvpdUZgPOppMoP5fSxkKAPed-LWetPmFn87-f5DXPRV0A4uUzIcalULc9DZAwiEyly1iDUMBUN8K6PwY3PNWd4c_uyeNLwgIJLA3R-W9OUtafBH7XWbv7WnB5JMh0yuV7wfOQYLj724YTnGiNY9J8GofIffHH8fBZFo3pv7yTWzsk_1sQ0MWmqB53BOm86DNfwyYc-3Gvj941WP5KX3pPbuZ54HCgo6ct8gWL856_YZBx9ke1dm7_-CYS8B3Mb2OLc9WsdlYQpaX60QUAyv8In0u6yBgw2ISssAEuSP5N2otW745D4n0OJEgHyrAObY9Zc75nai9STafiEdaAaKE8eHXhWMvfU66i_VSvpGAXS4ZOEEDYjSk_ueRFLQ0LwHc7vwp65SeUjXx2iad7pqMyBiby1RSX1i--r_ExopU19tqiRkS6MjVdZ2ePRvIaBA8pzFwEoZkuVHUE7tfcRIZ_6Llj2wK-gf1rgJhwdj4LoUgQuwHD8rxnkP1_0CEFrxIzRpjM96sQhHi1Ix3ES_10jkGxjVHaJlhUtmuU5ceAQYwgevOxvAwRjA8LUoo6GQDnmbtH6hD3MovoeWDq1g78bBgQ_Zgl1QS17wqK7Yd4YRWqtHTXBRPb2sdEblZJ18z9I,
67,TSLA,Dow Jones Rises As Tesla Rallies On Musk Robotaxi Comment; Nvidia Reverses Lower,https://finance.yahoo.com/m/20683c73-96dd-3619-9444-749f97207faa/dow-jones-rises-as-tesla.html,Stock Market Today: The Dow Jones rose Monday as Tesla stock rallied on Elon Musk's robotaxi comment. Nvidia reversed lower. 
68,TSLA,Tesla heads to court after Apple engineer’s family says Autopilot caused his fatal crash,https://finance.yahoo.com/news/tesla-heads-court-apple-engineer-135625771.html,"Tesla and its controversial automated-driving system are on trial starting this week. Jury selection is set to begin Monday in a high-profile wrongful death suit filed by the family of a former Apple engineer who died after his Tesla Model X crashed while the Autopilot feature was engaged. The trial could last several weeks. Immediately following the December NHTSA report, Tesla recalled all 2 million of its cars in the United States, giving drivers more warnings when Autopilot is engaged and they are not paying attention to the road or placing their hands on the wheel. Yet the company maintains that the technology is safe to use when used correctly and reduces fatalities. Autopilot requires drivers to keep their hands on the wheel and Tesla says people who use the automated-driving technology should keep their eyes on the road. Although Huang’s family acknowledges he was distracted while the car was driving, they argue Tesla is at fault because it falsely marketed Autopilot as self-driving software. They allege Tesla knew that Autopilot was not ready for prime time and had flaws that could make its use unsafe. Tesla did not respond to a request for comment. “Mrs. Huang lost her husband, and two children lost their father because Tesla is beta testing its Autopilot software on live drivers,” said B. Mark Fong, the lawyer who brought the suit filed in California state court in a May 2019 complaint. If the jury finds in favor of Huang’s family, Tesla could have to pay damages, and they could add up quickly. Wrongful death suits involving big companies have at times resulted in awards north of $1 billion. Autopilot’s promise has also helped to boost Tesla’s stock in recent years to make it the most valuable automaker in the world — even as its stock is among the worst-performers in 2024. Musk in October 2023 on a call with analysts aid autonomous driving “has the potential to make Tesla the most valuable company in the world by far.” "
69,TSLA,Tesla Stock And The Robotaxi: What We Know And Don't Know,https://finance.yahoo.com/m/08cc57e8-56f5-3a6b-a3c6-17c44b21562c/tesla-stock-and-the-robotaxi-.html,A lot has happened since Reuters reported Friday Tesla has scrapped plans for its low-cost next-generation vehicle. 
70,TSLA,"Company News for Apr 8, 2024",https://finance.yahoo.com/news/company-news-apr-8-2024-132700625.html,
71,TSLA,Up To 50% Off Sale,https://a.beap.gemini.yahoo.com/mbclk?bv=3.0.0&es=AQAAAGwD9uuUb8U1JX2R9fTB-sNv3FcGITixkSXoHx0Mi1FWDiW8m7rqFnqRf_Qp_bPZ-MJ9Oemz9SaLChZGYU2m-HFIxEELPxkeyTYczl8Vm1zU-N3oepRUMmTSqiN5gKyPF5LcIlDOjP6h-Rt18ZdFmEN0K45XBSZwqV9ULC9faQ441cGzwywJY9jNtktrWFdNoTjrs67L5MHo8zs--Wrhc1-9Puaa94lQpIB3-dcYhdbupICcZwZXUKBZwOAXYWpknk-ciiGK_0h7g2oaM8-ZHkheckes60ox1u447Sl6FOFgqIsVg8B7TCtmVN-WF43YvQitQXqqXer1Hjzq25bSUYSgOHviz7RQYQ2IFc9aYSsZisYrw_med6iy9100dsERlEfpPxbpGVuZkptoAyFQGBcAX68PwaU9n5Fg3e80Zm5JK3cjDqLI7Py-Lr4aRWEUZvjMM78phsHIJBGyZ6RZno-IwCA9TmSUmGFH2WX11MCt_lFl5NQJhfHWAjPc7_PA1Ad2umFuX-zwwoXjaLTXJKu4hftiYwqsVlfQVApy_EJ1nimrNk5a_-ZM7gjMexezAWQPvq4BoaYZ4452ywZdilqpAjPeuE5ivefkBFqzMnYhcgwgBf5Tmb1n_GNeG1hjdy1syoVQ5n6ixMjX3mkI1pxy41Bd985azZPKvGwnMhy7RlMZkQi5oeVgJT-D5xnFHcJ0_5wdNBf3tAmlsK1niuDiXK26EpVkF61i3uQsp0bdZySc4Oaw8B-vn4Zpu9K01bciooi8mK9A2QyWusjq24lTqpLbV4GgZ0_R1W4WhsNZAdWik0zWBsV7bCd2tJbqxvo9w0UCcmVz3osyoVdgCeEyAlK0-2fRKgl1FXvB2YzxM8bEmSO1AtnqvpjfQz9Tihe_gVHFOXc6bs6oNh6LIJ7qbZg0nIsTeoIUnANRWrBkefFWEBB8UiRlKwMNcMynYaXEKfXRLE7OmmqpTB7XyfEDcQYtI9dFAB1xLQ39riZcbzkXoetVomgMFLaqDNZVWdynCW3jxdhSxG_Er4jO2mMigpydamoHxWFBnTzWVyjNQbUnGTVVaBEn_YM-ORSQXxupvrO-3iTrb3J94rHjcpp2fLD_9Q1VHLVuGNI9VSEgeeOC4kZmnP_KWY4p3jSqG4vbLF-V7Sn3WGLS-wo2kJcRb2Xe0YGfBa55gaxKMVDpiYSAD8HY_xrvKevWoUHeAAQh36bmMOGsR4OX8WhMGB2Q_zetJ-46G_i127SfN5swaLKoqmd0QiM_RKOS2nbyA-HIX7v68GJ4pHN4WFmaH2YnJZA7Z48cyiZBlPI5-fptV7Cpu-ixJRY9CUTxBasGR45Nn56yGrNnRrJAFq1D5gU-NvXZbd7IveryuSCRzArA_i5-1pko5kKsUMzNpp_0qKHopdH40aDTmZbys47hFPsygemwVVbAnRt588zIF3JA337eYxkKlj6xnn631An6f9Tc6ulTjNyyngepd9F4caWPyr2z_EQHzLy0gPjCgaVRrJJrDtaeQDajz_Tq30LTYHZsziOWL0_KZHYzcvip4kV0jKkVzgNhicsiZGzjYBIClnQG_-OF2bByqUoson938OmlP1oAndfwZzYNLsjrGu9d04nRdHSu6XcP1kZ9dRR119qQs7iIUlZPwOvfkd7wnGPE_GmSQ4QPun8pooVbgKfPxoPIJqx8Svc4BrFYY39qbqdwDWLhdXcA86nSSXCmOtspig8z8zNUR8fw_fnX_VtmdQreF31UxoGYeFLVP-Uwn2CPIdtvd1JX6F11CQiUKb7uVU9RtkGroechJWdyzIBFSVLHOuzz5l8Vccg2hlYoBLMa5epg6zK2QQJYQ3nGeINTG2gINpHFrRn_HFgithJ0rUGPldHw0gogy0zswRXJ0L8BkWOVflL0ZrSi37hWYOd8Wji2UEnSqUewf1HQ7979bolYQQIJ_z7MiMgnxzmTlfxiCQzhPiJEk1IWAke8_j9kXb_3fB1jGb96XAkXPP3DkRNIfZ0ylndBc868AVuf-4G9F4HC6N1Kz15NRJxcsslF7AJwsDpTQUwt5Ch1gD8VISNqkYUd4gsS3DUmU4R6jiauP6Ji_dC_F0zRzZT-IkyVwpaBtTi4mgFzHjUX_ktAkjgzqFAzQYklGGK8wff5QmaDRG8hnKC9e8WVLMXuM1BDFKscy0CK3DaS2vt7N5BgWrfbITH140P6q5bVxrhAUQjrqDZ358rGBAauRhdJIt-gFIKRLORyW3_QG1zbvRZ9kgd1gQWZMoeWVGeW9517AyfoYbKzp0DxWVjk3BMAb7qgmeDVbfT2ycArO59Ii875q_QT1HC6GIwcZkuWWsLdnNKW1sdq0_JBvFl5o__pleuIxsKJw4mvoUwl6avW8LotKADun6D7qa3q7me_TdV-m4r1a5Onkm27thooH5C-DDPN9QCKMo2jTTts8TDQkZMYdAtxbjekU5mhpReKZ4yfe691MtIb6eJl7iQMwvoKJmwTM4VotOzzC1lQwgCHkXo_Tyv_gMUOOIFj6zEzG-vznXRRPSh0INtb8nMSETlcqaqkB4jfB_2JwfHrCkpwkDwgmr5MJexuBYrA3XFMAZ_I4ehssvJuNKDpMDBK3BSzoWoanZDHVzb6HpiSj4FXYWyUi5Fh4ytLBTUpMa0BgYp0dF-YqXNcxE0zPpx0QvqBfQGaH6sNamwe-cK8b_yvzNRv-8Ze-MPh_WeVJejhqQTm_55k0f_HGW29sT748qwRWZees78BTAHUo59v3BfbO9K0r23j8DmPYVU-vGrl66Q8Y4XT_bG-qGE6W6anewcUMhGyZ0ctAszAQaGcjhvKyUej9yHpuMr0Qtcxj9ySFZ8kYEYm87Q81kNTNovhQEfvMySVUQYNdDSFk3w_NwxY9LFhfYTKrPriPnDN_2FrVUV-4kv-QNfvXRC5xmdauRgq4x9El_4_69FX0WoO98LHWk00xzApPz6Ak3Ck3Uk3bKMLwjrF7h90554k33BZPotAaVvh5gD4BCxzDVTRtysy,
72,TSLA,"EV Stock Roundup: Q1 Deliveries of TSLA, NIO, XPEV, LI & RIVN in Focus",https://finance.yahoo.com/news/ev-stock-roundup-q1-deliveries-131700159.html,"The electric vehicle (EV) frenzy, witnessed in 2020 and 2021, has lost its spark. Skepticism among investors is rising as EV startups tread on thin financial ice, facing the make-or-break challenge of proving their mettle in a fiercely competitive market. The industry’s capital-intensive nature is fast depleting the cash reserves of startups. Last week, Canoo released its quarterly results and concurrently expressed doubts about its ability to continue as a going concern. The following day, Canoo revealed a significant development by securing a vehicle sales agreement with Jazeera Paints. The agreement entails the initial purchase of 20 Canoo EVs, with an option to expand the fleet by an additional 180 vehicles potentially. Lucid Motors announced that it is raising another $1 billion from Saudi Arabia amid diminishing cash reserves. According to Peter Rawlinson, CEO of Lucid, the automaker is burning around $1 billion in cash per quarter. That makes us wonder if funding of $1 billion would prove to be sufficient for a company that is currently burning the same amount per quarter. Another EV startup, Fisker, has withdrawn its guidance for 2024 as it is evaluating strategic alternatives to keep itself afloat. The company, which has filed for bankruptcy, is also facing an NHTSA probe now. The following table shows the price movement of some of the major EV players over the last week and six-month period. Stay tuned for announcements of upcoming EV models and any important updates from the red-hot industry. "
73,TSLA,"US STOCKS-Wall St eyes higher open as growth stocks rise, higher yields weigh",https://finance.yahoo.com/news/us-stocks-wall-st-eyes-130950489.html,"(For a Reuters live blog on U.S., UK and European stock markets, click or type LIVE/ in a news window.) * Tesla gains after Musk says will unveil Robotaxi in August * Crypto stocks track bitcoin prices higher * Futures up: Dow 0.10%, S&P 0.13%, Nasdaq 0.19% (Updated at 8:42 a.m. ET/ 1242 GMT) By Shashwat Chauhan and Shristi Achar A April 8 (Reuters) - Wall Street's main indexes were set for a slightly higher open on Monday as some megacap stocks edged up, although gains were kept in check after Treasury yields rose on rising bets that the U.S. Federal Reserve could delay rate cuts this year. Hawkish commentary from central bank officials last week and stronger-than-expected manufacturing and jobs reports pointed to a resilient U.S. economy, easing pressure on the Fed to cut interest rates quickly. U.S. stocks recorded weekly losses on Friday as traders scaled back expectations of a June rate cut. They now see an around 51% chance of the Fed announcing its first rate cut this year in June, according to the CME FedWatch Tool, down from about 58% at the beginning of last week. The market has also pared back expectations for more than three rate cuts this year, from three to four a few weeks ago, according to LSEG data. ""A lot of people are trying to be overly optimistic with a Fed rate cut. It kind of doesn't make sense,"" said Michael Matousek, head trader at U.S. Global Investors Inc. ""We've seen economic numbers over the past few weeks. It's not hot but it's still running strong. So why would you really want to cut rates?"" The yield on 10-year Treasury notes rose 4.4561%, the highest level since last November, putting equities under pressure. Investors will await commentary from Chicago Fed President Austan Goolsbee and his Minneapolis counterpart Neel Kashkari later in the day for further policy cues. The focus will also be on the March reading of the U.S. Consumer Price Index (CPI), due later in the week, that is expected to show a rise in headline inflation to 3.4% year-on-year, from 3.2% in February. Also on the radar is the release of minutes from the Fed's latest meeting, in which it stuck to its guidance of three rate cuts this year. First-quarter earnings season picks up pace now, with banking giants JPMorgan Chase, Citigroup and Wells Fargo scheduled to report towards the end of the week. Meanwhile, Wells Fargo raised its year-end target for the benchmark S&P 500 index to 5,535 - the highest among Wall Street brokerages - from its previous forecast of 4,625​. At 8:42 a.m. ET, Dow e-minis were up 41 points, or 0.10%, S&P 500 e-minis were up 7 points, or 0.13%, and Nasdaq 100 e-minis were up 34.5 points, or 0.19%. Some megacap growth stocks rose in premarket trading, with Amazon.com, Nvidia and Meta Platforms up between 0.2% and 1.4%. Tesla rose 2.5% in trading before the bell after CEO Elon Musk said the company would unveil the Robotaxi on Aug. 8. Cryptocurrency and blockchain-related stocks advanced, tracking rising bitcoin prices. Exchange operator Coinbase Global, crypto miner Marathon Digital and software firm MicroStrategy added between 5.4% and 6.6%. U.S.-listed shares of Taiwan Semiconductor Manufacturing Co (TSMC) gained 2.3% after the U.S. Commerce Department said it would award the company's U.S. unit a $6.6 billion subsidy for advanced semiconductor production in Phoenix, Arizona. (Reporting by Shashwat Chauhan and Shristi Achar A in Bengaluru; Editing by Anil D'Silva and Pooja Desai) "
74,TSLA,"Investors Heavily Search Tesla, Inc. (TSLA): Here is What You Need to Know",https://finance.yahoo.com/news/investors-heavily-search-tesla-inc-130014924.html,"Over the past month, shares of this electric car maker have returned -6%, compared to the Zacks S&P 500 composite's +2.6% change. During this period, the Zacks Automotive - Domestic industry, which Tesla falls in, has lost 5.3%. The key question now is: What could be the stock's future direction? Although media reports or rumors about a significant change in a company's business prospects usually cause its stock to trend and lead to an immediate price change, there are always certain fundamental factors that ultimately drive the buy-and-hold decision. Here at Zacks, we prioritize appraising the change in the projection of a company's future earnings over anything else. That's because we believe the present value of its future stream of earnings is what determines the fair value for its stock. Our analysis is essentially based on how sell-side analysts covering the stock are revising their earnings estimates to take the latest business trends into account. When earnings estimates for a company go up, the fair value for its stock goes up as well. And when a stock's fair value is higher than its current market price, investors tend to buy the stock, resulting in its price moving upward. Because of this, empirical studies indicate a strong correlation between trends in earnings estimate revisions and short-term stock price movements. For the current quarter, Tesla is expected to post earnings of $0.57 per share, indicating a change of -32.9% from the year-ago quarter. The Zacks Consensus Estimate has changed -8.4% over the last 30 days. The consensus earnings estimate of $2.94 for the current fiscal year indicates a year-over-year change of -5.8%. This estimate has changed -6.4% over the last 30 days. For the next fiscal year, the consensus earnings estimate of $3.78 indicates a change of +28.4% from what Tesla is expected to report a year ago. Over the past month, the estimate has changed -7.7%. With an impressive externally audited track record, our proprietary stock rating tool -- the Zacks Rank -- is a more conclusive indicator of a stock's near-term price performance, as it effectively harnesses the power of earnings estimate revisions. The size of the recent change in the consensus estimate, along with three other factors related to earnings estimates, has resulted in a Zacks Rank #5 (Strong Sell) for Tesla. The chart below shows the evolution of the company's forward 12-month consensus EPS estimate: Even though a company's earnings growth is arguably the best indicator of its financial health, nothing much happens if it cannot raise its revenues. It's almost impossible for a company to grow its earnings without growing its revenue for long periods. Therefore, knowing a company's potential revenue growth is crucial. For Tesla, the consensus sales estimate for the current quarter of $23.97 billion indicates a year-over-year change of +2.7%. For the current and next fiscal years, $108.97 billion and $128.18 billion estimates indicate +12.6% and +17.6% changes, respectively. Tesla reported revenues of $25.17 billion in the last reported quarter, representing a year-over-year change of +3.5%. EPS of $0.71 for the same period compares with $1.19 a year ago. Compared to the Zacks Consensus Estimate of $25.94 billion, the reported revenues represent a surprise of -2.97%. The EPS surprise was -5.33%. Over the last four quarters, Tesla surpassed consensus EPS estimates two times. The company topped consensus revenue estimates just once over this period. No investment decision can be efficient without considering a stock's valuation. Whether a stock's current price rightly reflects the intrinsic value of the underlying business and the company's growth prospects is an essential determinant of its future price performance. Comparing the current value of a company's valuation multiples, such as its price-to-earnings (P/E), price-to-sales (P/S), and price-to-cash flow (P/CF), to its own historical values helps ascertain whether its stock is fairly valued, overvalued, or undervalued, whereas comparing the company relative to its peers on these parameters gives a good sense of how reasonable its stock price is. As part of the Zacks Style Scores system, the Zacks Value Style Score (which evaluates both traditional and unconventional valuation metrics) organizes stocks into five groups ranging from A to F (A is better than B; B is better than C; and so on), making it helpful in identifying whether a stock is overvalued, rightly valued, or temporarily undervalued. Tesla is graded F on this front, indicating that it is trading at a premium to its peers. Click here to see the values of some of the valuation metrics that have driven this grade. The facts discussed here and much other information on Zacks.com might help determine whether or not it's worthwhile paying attention to the market buzz about Tesla. However, its Zacks Rank #5 does suggest that it may underperform the broader market in the near term. "
75,TSLA,"Dow Jones Futures: AI Leaders Nvidia, Super Micro Forging Bases; Tesla Rises On Robotaxi Event",https://finance.yahoo.com/m/9ae22bee-08be-372d-ba72-ca04a8ccfafb/dow-jones-futures-ai-leaders.html,"Indexes reclaimed key levels Friday, but are still rangebound. S&P 500 winners Super Micro and Nvidia are forging new bases. Elon Musk teased an Aug. 8 Tesla robotaxi unveiling. "
76,TSLA,Save on the new iPhone 15 Pro with titanium.,https://a.beap.gemini.yahoo.com/mbclk?bv=3.0.0&es=AQAAAHpySURz2UtBf6dd12uJZtiQfOYBujy_D6LdA3Sy8y0VQD-W_FcnVyzL0alhsq1IReex1x2nk5h3qPwLUfb21yVtn8CiNlNluiCGt73VvM7FhY6ex2bjmJBghXo3SRfWRh5xzFujyuwt8ZQqwQyIRMKYeReRFR-K5c53jj3FpmnHh16c3bfMET2AZ8ni2BknfVMVHq7hjEZSEP332-yONEMFWi8ZM2lbaogc83XSjzhaIfWaro-Q8_Grzu5w8S0-FQx-7V4p5SR4eVV78k1Um8sQRoTz4ugTaUzkH7E2lSBAfvdPf0ILn0IuXQ2HK2ZCYYc_XEZ9BySPdUz71IccSJVAxT0co_hvSXIni2tOWX8BQw51U0YmCcb3qoWpZRXvZMjqUsp94PT8VE1yoC2p7AfsyvEQiN1pgvqBoNl7fdt54eCEjQEyoRzYRGcU5eXQSYZwBM7UmF4Z-Ci0i3wXa5DTjNsGkxImlgE0NRty1GOIXGLq1DBgB_B8Xjyf8sEsGSLBN7Od_o8M1fd-YhF4tt9p7jRUVIWpLi6jCwkeS0LyP77cHagHyk_6uQnU4tzVleNvdGLCMMkvAxOOd2u4tn77l-Y0NdWoh3zPKwqxvf5SMGLPgpWSNm0QWFPJQMCFoSd8mvH97XGyoQM2Sqw_3seeKaf3PujDE3F2LKjaGcRBEm2cDxA6OFDURsRUHizvmvIOAH1XN4rSzPTiQ8XOFssaHusz9tx-1Qy6IBoe25O8VtY1LxA3GhG-7FcjGK1O8HwS8HSzoWPWY3xf484kLjCidudESgDHURJ_cmAsKoOgfMDr-qcscOQriScVDH2iCQ316DQW2VuGr-g5g5QvhwXVV6xjrtdMl8NeFxMKBsteCDM-M4yzW8CDf9JCyToy4JsqTI8k7XjZSNMKTVg8yXXDIeTuDL7yFzQZtI28z3qYb13sGRy5X2UbEyHtk8IPLWGTH-_zjiRL0sHMvQgkW6jdwKDXEiEudlKB-fyIEkqGOkOuxpkrEwFQm1TYtKTr9N_nKdlDaH9nG_bD6Ho8u_30L2Mg0tFiz5ZCHv_y0MdnWGugWrpGrL5c86RcfumfoN0R9IMF8ZKTy4OtzKTauDImDqrua7RrSER1SI9YIAojkCrsQh5E7nozQ_dMf89MYxBGuey8B24GjQIKUV3oa9u8g7PVOD3Xa0jKxGOJjspENrmBzoh1fqR6hBGIGGAafH0wjfYxIT7Ya2n-xcNE3yONhtDIJU6EW1JdmnTFEdZsb1l4FkwmbVStsI7582GGJcmH6qmxyT5wH_y-OOancVa444CY_B7bDmv1yP0RVRLfJ_17gGXGMDUR0obYwdVyCkyaf-9y75SYvcbabgVTocB5bLRF6DyyygIhEhTOgOG2CjQ_qH7leB5jGkQojB8ELnOFmG_fa4szro7hA6bCwTyOHWKwc5ZDWdYmOccGlpLDMITDlzu_tWXgmGMX-m4NBOvd0I7lpdORNU1YeRcE6S-L9wsZfilMnEPCVWN4nLqpwQj47JEKcKBNKHbJkfXvVlRy3B-ya-enPPAwTAcLzconG92eKbXpDBHxx2Xv3LGOX6TuR7ISLgMv0wyC-EMBTSk8sW2nFj0ZV99Sxh67bzczFU9YX1OnVGNMVqLtMsAHmgcJw0JYTO0XxURXODKk0qHpCKmk-x-GlxryBKCHaP7Ye2M3cq4VebgqlC7wGwyRDntJWUxfBSbxni3CCGpPPtEdP52mEFO_GQjYpYoCrX9m1lR_l2SLJTbAGZgltvoKNftQdz-3uIv5vesONnaFxgMxmk8F2__qcotmfilNvM7zmrKzIX_N9LiFs3lg7FQBuoDETCeipBR4tiaO_Ual64q-FEUfE8SI02NOe_R-eFPp3qCeeNzpfmiFEPfsbkUV93NBmV2tnTHwZURzdeoMcM3bxviZlj021-p_YH8VzgF7yat5gPUAab2CnJQM4Pv7wyRqtpaIpyK-Aajjq0gwxN5aiTkrcwFiLX3FP8tLd1IrKIfQwr5OMGincLJ_AHA4LXLJnKqVgCIlcO_FdYLDVap-ieOBog_IHLKMqQ7NOsDlumuUPYyCci4n98-vMS5I4zD-ONK_q-5be871B6OFld5vbXzHmlEbw1XzDI8qO4l7hIhRF4C9v3XJrVvRC7pH2qQgJtC-Nz7uWDtfW2fgfEOPOJFj_VqGd7tlG2JSbw37WpcLrh8C3JGVwBoHfC_B9axnpeeHHiIT7UCxSWztx2XVnGWyTR6ztaF69k307VkEaNtr8chvqX75Mi-41wIx-dVt22qHggoqqbgU5kFZEzR4IMYnw6TOD_fWYzWZTilmlextsFOk_N8yCJDOf8wUWdRs_etq3CiwZraZ3ZpI9Vd6LWJ__Vs-VNzHK6fwwYEYPDM5hvbkrbMWKhEmTnTA07lTYejjeq1wtPSDqKqgqWjtqBBOnoOlVwf-9st2pkfWi_a64lFAgUnf_IYpnll7vCIO2gXapBiYlk075Ht5pDaK08BCCiS7moelGmm5vujCqjWb6-BtYCCDYHefD2JkyjX7brj1AuHXc8a2RCd22XeNVwsGgipqMwsWjlFJtfWxy5NEt3pNhVPq_OpaNSCSG0Ob-r8AE0QqN4bir5_iC0_VUqSGbpow8I-QQP8nC7gtEoZV0gRS1f-sdH1RN0l3qVmFJhHnxW_1jb-ulzllmNhLMe6WjPilYRYszFUgfmpzqI-WVjwz-4UqngTxEGbvlwO1MmOPEZ4Ln-e0JP-qaDP4TyNQbjqbr5Qs6WEe7KQRppqOBqziLWZcvMYI952yigg6wat4Kil0xd9LCxDNfO4UwlBw3sOtKEW_F_m11TQhXq_z30BbM0nezz9vvxG7UlklHOR-KaC3pvNGSANYn6Uh9h0xvbVQe2NxYGIL84-yYOIpujK4CMgL23DvkfN_kOQqpzO8pd8QRUPic0udHqzol4ghurbTYUOSC-YBL5SDRegOsf6pZly0NT0o8ypR10-FrLa54bNxTkyeuJOtIwEDKragAtq_wxcKm1SbY1zge3Be5Y9M-mCn85s4lsJERWvqJoKo0ZDbhLELWtrrfcK2z1lnHmIal4F4TwfQdN-gUp3g0WPVccgvNJulq-h3q5yaS3OzZ7SN7tlnR7Ob6ILtvP34HZ8Tmus67F6TkAuhPAphnbmzkFxtl6wT1VCl2jRY0dwPYScve-p-MPlu9LYBxp5VPkHHCmcfLp5tmFdyTzIZXDUgASw49oOImfrr2GVtyY1I_arNi1lpQ0DLS1pCMsXH83yIGJrPRVwpsIW7yJjwsPN53Lnw-cH_tUI5vRmqj7zq8Ss3WQkCCvIljuNN4qXVseYgr5NT-A,
