,ticker,title,link,articleInfo
166,MSFT,HODL VanEck Bitcoin Trust,https://a.beap.gemini.yahoo.com/mbclk?bv=3.0.0&es=AQAAADQB5KqKwzywD4Tuvqbzm9QyBh6iaVq05VIwXs8KVhGu3mvLjASN4XP7UHW72KM5zyCEvP3apKJE8FcjHcSG-OgIO7X2_KvvguKpPxSx3aIyOYSz4nYJXWL7A4QsW_eOPfC5nUWH9uFaP5GKhqUZXRCwRf-Ywk5VDg-2b8x-MGuYni59okXQzR-vNHBPquwCJAMZpDv7PLPrbqU9RkVo3Oz-VnHRa6j-43JR4kBqqDmn897q_k-vL9dDRq_g7zZ_RebDZ8v8Xafp6V7N2gVDyUblqucexW3QAQ3-_WDlEb6ax2ePavUhU1MUAJ32L_rvg1Bd-4eXnkMjJ2syu1zSuyswsz85bdREGxYXRWC7MszlYZNpW_amiYT4wVJnWClUXCDUjZdyu_GifZqxcv6rUu-NjSoMNsKPueTv4NPRjhMUovopgVnHrtCJybKghEu7ULbOmfm4Di1Pn2a4FPDYfAt4gJppraF5eho-fDyot3Xwe5uGRy8rETHfwi5wSKdWItJZy4wVxAqhomRJPHS3yBKRPD9dOoWBO_5EzyJhBaDxJN77k3Hp4_px6Q_pUVYruyDiGKoU24KKqV1fOpwO07q74YggebD7b5MN4MJajxa3GWx_xUZVsby35AIpzP5fnOu6521m6wS7CYsxnS0tjhNPe_5GnMbxO1leilYdlAeW1Isb-yzA4Tovgb8oXZwQbcvbzDoQDnMD1W0MpkoiaJJMYVtgC0dwTpKNh27EMCYJDk46TCKji5LTxiMTL_pND0f9DUJb6DCbHPte1BLkbvH11MEGXAL6VaJZSS3x2eSNumAxSvUQvZFw6YuakjrvnvujCO-7fUUuD_txZ4ffKN_mNd3V0PeW5j8MXr2ZD57qPFV11lPaalDlQqS6QVOGZPHvirHaCF7pHQ7PmTTIUAuL-lZ0bl4ar8tf6D40pfzbtoPkrTgJUhJ0eM4xfX91xm1GW0kfLertSniXxgQQyw9InNL3wxYrGPLtBYaVffNn0qwaqpPYiQ43T4en08gq3bwswxXnR5RtyGiTm-JQm9BzSAAdMR-jpxjcogjadsu58W9EGpVvBshb6ak9JT3h220Rv5DLb15yMfNVRLa3E3rJ9X8ZmAy0bf8SfiwcNcXBw3g9Yx4sDUW12hIgt2X9NkFyDqUBaYQFq_6WIdoBCx85zQf7VhXj4y_5kH-hGfKF_GxQkxRu2YQFqvE2RgRd_Rob1oTiZ9ArokFA-1vXxFsmgGtX_IT3U3qTNA-awHuLrDuQtpsKX41NNn6RzSp1qrl-EXSd3EXMBf2W4SRwYdKPOxS4ZpRU4VOASvwhcZtWjtZB4b29fK8Ko0aQKXu23bXfpFqgVcxaQoMZO_BHKfGWyaRnldxKOjqJbOEML_Oh2X6webKsGdEaZYBP2tKdKU80Bb5KrGXQEGzw04C9KiEUbmaL5MR5FSIUsrSYrqL2JfjHz32mtmXpcqT8eM6P7W08OJKCe0BOuHLZSJ2qGcCbg4RuUZdWYPUTYUdXxTDNaFi6RCsrPSXpj5jjlP_Ar416dukjFF3dxdkiG1jLRBZEwGF0g4dp8zvedfgEh2fzzO4-oFuMtvyHU4Yqr4BDgqwkEz78H3XDRy16yN4wsdNOLruQPqug29h05ARs8r9QHsGlhsYlbCSJ0FL9VZ1e7lJI7oOeqJWi3J-VlfIi4XI_ehd2HtVK0QVtBnTpouy7dLt41UnZ8KkYdog-eTKj0659W8Avo-_CGGG9JMyV11I3I37HKLukl5OSQyc4c64lqblOqwND0JPcJ6MvQGNCcYoqHrwD4_39qhdVJ6_UknXrlBqgA5i8KMhR3q-RbKb0MLhlm-Oy7TDdUTh_DO8b7TUeU35htDzHnlEsqayi8_o_f-HMjm9uTwUfvDJk_N4JnRCwYprXZopoIsr61yUmPlEnfS8E5Qlvg-S1uk-uqBXsOt_IebsT9iJ61QzsJdX4mmjTTrFebtxqha3GHviaF6LLT5JWspWpAXIEyHXxExLDNC39gr7FX6eyf74vgFXYzdLdTKdtO98ZlEP0H9_H1MRsPBxEwxw_VJiR9CVj8ycqMlstmLQDclUm9DTCuygJXE7RLkgWtTNj0mA9dqZf8X6VlZHJtBWDIhOxCFcP9DJPu_gQyZ7G3uhAbVWFIODla2f1FrLvkgHmxpMuyFVVaB-ZFlQZjUe-xA96M8BL7FXTHHH_yHxeqGHDv-gy8bZmq8Mn8QoKuv97ZfBTs0HCbFm7o-36zxbNnw5bNaZ-kVPK-RmRhz6bCcQIhvSE-2ePByR73r3dYfWRn5PXpmxcdkge5VaW9g4nepF2GtlWZSNvL8hwevMpw-hJV7DyRrVCX9Q8mJyN1bA22jlgewpsdIzLDMRLmyDbvDwFDTOJ-iI7njbJTmgu6Yv587_SvH85fyQbkNPVW0r2s9VhCNJLwwWlwP3M4sQBfI7X_DDaZvmP6ShKLlLrVdX3Lesk3UcU1yW3AE84h0fUa50wNHPDCDGgqRdzn8PXnBziY3IaSJKx-vRgPBrypJoAj9u6bgyl2MksV8Hpz_ASm4_jJMRF6zir4k28sMIVZ5MhCraZerXxzfBg5O2qePLDIMqabku3mTzpT2QJuKRm0rsNr9U6QyNqxW_tpKyfx0OrbpwkzVQXxO6VpLqHs3ebRO0YJgel0McUsUxhsmyobrenFLUvSDkyr9PHtRepPsv1wRLgFbpOudtF34A132shZLAHSKx6AOoHyWn9rznDVqQUG_4HxtqqJfl1QNY1e5Ys90Z2TDXbSu-xtSEUQWeS02OIPKB-3foFzwjo-EHMgM7MIl9uDKHtROewL5wPtD1PZSgUobG6BVFAHOrwmTEAqv_ogEwT5PivZEX9xk7D-h_tWVEd4aCuGO9SE3lzK2qUc0PBZIwYAjtQ1yImZegOuDYfB7skcKBz3qusn_iraHp-j7Zl8CboXE2Qyc6wBoCT3vdQKquL3ekDETBxqZSszD_yba1PzMOAjGMrcbIv-nta-50VUYoLwEGRHr1knBO_2n-9o-0NzPALtmKjEsc1Bh2HAQhMIxaMPGbiv5_NJIrWvJ8ValQrSg7OwMab9p60-Cw2fjyOZ4EYDPF13nSdX85odPMcxUSXH3iDXsoCEchnPnfaD7CBjv0vDQ,
167,MSFT,REFILE-Microsoft to launch AI hub in London,https://finance.yahoo.com/news/microsoft-launch-ai-hub-london-110539850.html,"(Removes duplicated ""has"" in the first paragraph) By Martin Coulter LONDON, April 8 (Reuters) - Microsoft has announced plans for a new artificial intelligence (AI) hub in London, focused on product development and research. The unit will be led by Mustafa Suleyman, the London-born cofounder of Google DeepMind, who Microsoft hired last month. WHY IT'S IMPORTANT As the primary backer of ChatGPT-maker OpenAI, Microsoft is a world leader in the rapidly-developing technology. But competition for AI talent has been heating up across Europe over the past 18 months. Microsoft may seek to poach experts from other AI-focused companies to staff its new unit, such as DeepMind or OpenAI. The move also represents a win for Britain, which has sought to bolster its credentials as a technology superpower since hosting the world's first global AI safety summit in November. CONTEXT Last month, Microsoft hired DeepMind cofounder Suleyman to run its in-house Microsoft AI division. Suleyman quit his own recently-formed company, Inflection AI, to join Microsoft, taking dozens of staff members with him. The move received criticism from some corners, as the staff transfer meant Microsoft avoided the regulatory scrutiny that usually comes with a traditional acquisition. BY THE NUMBERS While it remains unclear how many jobs the new centre will create, the announcement builds on Microsoft's recent commitment to invest 2.5 billion pounds ($3.16 billion) into data centre infrastructure and improving AI skills across Britain. KEY QUOTE “I know – through my close work with thought leaders in the UK Government, business community and academia – that the country is committed to advancing AI responsibly and with a safety-first commitment to drive investment, innovation and economic growth,"" Suleyman wrote in a company blog post published on Monday. “Our decision to open this hub in the UK reflects this ambition.” ($1 = 0.7918 pounds) (Reporting by Martin Coulter Editing by Tomasz Janowski) "
168,MSFT,Microsoft (NASDAQ:MSFT) Is Achieving High Returns On Its Capital,https://finance.yahoo.com/news/microsoft-nasdaq-msft-achieving-high-110031174.html,"For those who don't know, ROCE is a measure of a company's yearly pre-tax profit (its return), relative to the capital employed in the business. The formula for this calculation on Microsoft is: Investors would be pleased with what's happening at Microsoft. Over the last five years, returns on capital employed have risen substantially to 29%. Basically the business is earning more per dollar of capital invested and in addition to that, 68% more capital is being employed now too. The increasing returns on a growing amount of capital is common amongst multi-baggers and that's why we're impressed. All in all, it's terrific to see that Microsoft is reaping the rewards from prior investments and is growing its capital base. Since the stock has returned a staggering 269% to shareholders over the last five years, it looks like investors are recognizing these changes. In light of that, we think it's worth looking further into this stock because if Microsoft can keep these trends up, it could have a bright future ahead. "
169,MSFT,"Could Microsoft Stock Reach $1,000?",https://finance.yahoo.com/news/could-microsoft-stock-reach-1-102500803.html,
170,MSFT,An Artificial Intelligence (AI) Game Changer Could Be Coming: Here Are 3 Top Stocks to Buy,https://finance.yahoo.com/news/artificial-intelligence-ai-game-changer-100700408.html,"The highest level of narrow AI is superhuman ability. Google's AlphaFold has already demonstrated superhuman skills in predicting 3D models of protein structures. Its AlphaGo has beaten the best human players at the complex game of Go. Development is underway for technology that goes beyond narrow AI. And it could be the biggest AI game changer of all. Some experts predict AGI could be coming soon. Google DeepMind co-founder and chief AGI scientist Shane Legg estimates a 50% chance AGI could be developed by 2028. Anthropic CEO Dario Amodei expects AI that performs at human levels will be available within the next two to three years. OpenAI CEO Sam Altman thinks AGI will be built in the next four to five years. The most advanced large language models today such as Google Gemini and OpenAI's GPT-4 exhibit some attributes of AGI. These models probably fall into level one of general AI based on Google DeepMind's classification framework -- emerging AGI. AGI holds the potential to accelerate scientific progress dramatically on multiple fronts. It could radically change the global economy. It could also make some investors a boatload of money. With such a massive opportunity possibly on the way, several companies are scrambling to develop AGI. Unsurprisingly, Alphabet ranks among the leaders with its Google DeepMind unit. DeepMind has pioneered several major advances in AI, including the transformers that made models such as ChatGPT possible. (The ""T"" in GPT stands for transformer.) Google has also invested $2 billion in Anthropic, another AGI developer to watch closely. Alphabet could profit from AGI in several ways. It could use the technology to power virtual assistants that revolutionize (and possibly replace) search engines. AGI could be integrated throughout Google Home devices. Google Cloud could host AGI apps for customers. The company's Waymo unit could use AGI to improve its autonomous vehicles. That doesn't mean Microsoft won't be able to benefit from OpenAI's AGI advances, though. I suspect that it will. If so, the company would likely be able to monetize AGI in several of the same ways as Alphabet, including hosting AGI apps on its Azure cloud platform. AGI could also help Nvidia make better chips. CEO Jensen Huang said earlier this year that the company's chips ""can't be designed without AI"" today. Huang, by the way, predicts that AGI could arrive within five years. Now for a reality check. It's possible that the predictions of AGI being ready in the near future could be overly optimistic. Some experts think it could be decades before we have AGI. Even Google DeepMind's Legg, who expects AGI might arrive in a few years, believes it will take decades for AGI applications to be developed across the full spectrum. In the meantime, practical issues such as premium valuations could cause one or more of these AGI stocks to underperform. Over the long run, though, if AGI achieves its potential, Alphabet, Microsoft, and Nvidia could be even bigger winners than they've been in the past. Before you buy stock in Alphabet, consider this: "
171,MSFT,2 Insane Cards Charging 0% Interest Until Nearly 2026,https://a.beap.gemini.yahoo.com/mbclk?bv=3.0.0&es=AQAAABPWXYp7-dQ4R_X6ey6776eudH-Tnr1rOANx2ugu3Sy_vgOn9uEwM9w9D6lwmjOD7msHm184-KCtyS9nEFD2nZKe--juN1d0VIdlEZjPnefX3LysF2uWJFeGtzYY_D8Ccr1bMUC8o8RytxkZUN_ZMsRfKkBbxgNIJku8_hObpn1qc8lbQhrjSuWIxQFc2J4zQGmz6wFvTve1IBkLuXHpkNOesR60hfxd2D2BCFrdyM31mikI4_YiD3hQDkxP4l7v5-oagM6jqxJTOu2zJilP2RuNPryLuhsZR3H-wC7OcErDiwPzlIjX34zV0febNgM_q76v2KNSHNRYZZQPzhzL66OVjzrT7P73SLUmvAmVEyM16VZ8KLhNQZCdKOiModjlUSyCsLwOc2lXYLZRCmMImgJul89cx8rkecIdCOIcWrdanQAJZZl3UyFX9wtgp5A59WkZ4DoLC7uJLhsWzQu-6d4Y27qJimt2FU1B01y1hbRD00_DWdVd0JDckPSvM-gtJoM-Z-7tJmOIZIJjQwpKRJ5INficN67BRIEHEw9lSNfuIDO4O-83uwtrfKjvciNCZmoJqkdQ4WLOrHDm5sGtEWrsO9y5BlZ8MAFQvvGqYU8NOgr_VsH1fNCvVrE-c83A6UAbVAdEc12FuZpZHgH_52YpsbzqqISUCg4oTBIYZpZM9lCjgtnLmEmE-saShxJrIp86mq_tee456oY3XWXUy_gVtfLigzD9RPluWintGSxGIOvWC148VGgajCZyL3cRTxXleywv8RUdKQAXIXcFpAV0qXL8vQzts4yjpIL_XOhSd2k6GvflxuqqxDsh-rRTBQuyLkydyt3WaTmYIsKMXyoYKJX09CWQbkRuTTxI8AC9rB41A-cI_OwzNxBrvlDEElkESYwoeLnzMlR3I3SGi43JwAFOTkdCCVYoQqCuuhwayZfFdUyrON11UYPETVNmYi1wsh4n7hLWpcm6wr-T0w_JKXq0XJAvs2BKVhsQ_JrKEIrzmwnoz6It3dmsyUfayrQEa9pr-Zw7IL9A8ITPdG2XG90pUlvsxR1XmAmTBzW8whKcydod-d1IjibS4mp4zDfoNXHrx9Q4M-VOK04REEQB43mKVJNiU2BrBfGvClw-0nwsaFsd8ScN_1HCrv5HKrEtyluH6LCZo0OWr7XLol_HKzVvA2wc2qOKnO8iVDl6K9cbJHVoSJFUKVhxndEniOXb_4PhxJ8gnF5LjgDYRyrO4mGKuoz9ZsN6BKcp9AJ-HxNg21E2MrVTM1IcE6O9xyAMXiMlunxa1CuVVGL7D3RFbG0GN1Twv8mGCC8ZlRjJLyGlf7CsJ8EcBNqFmtsCpRBK08cmlddwlD0WkpOCvUjeZpogJGqHnM52iJXMhAjMFJIRzjQUuG3VwKWhyleuArS_UGDW7Du03xuYmzqqIhdJl5gQnABSF8r_3nkR__CWCmkbw3QtZLh6Qcpg3V45vGZWaa3sBMZbAUTOYwNPkHs41MQdamooFInXE0ZulTAbN1SajKUaOy1Nbh140XXQ86kFQPz72zbLb917_Pg7a7ECXCUkdYggMemEnWkAedh23OfeoEzS1Y_X40VZ9ZxQVcIRvCC4VNMXakITXcTbXyu7rvcfr1iVUevnte6mJzJu4_RnKH9e711rt0bHaKlV4qNAnTI-z3OUnT2WVzQLAOxnjUSHMW-oOCAlQ6TsCQzsWt3Z_bEjXtVjElG1FlCsoaewnTraFotlyriGULpCdCHub_1ZmfiWJKpnYmsp-gB9XYy78zQAoYZ75pNW14L1SDHvhsktRk6FXnhtcsfPV3BdgvbU-QCQ0gi7uDKTVKLZZnpP8CyxjfvdXqAvm9_cG1jV_HbMa_G5fmF8pXtmBmJ7LzYihSxYbvNpCh4xuZ9lVDV2yva57dKkTFvTY1IxZ70hFjCu4M-oAQZYPZ4yB1ukuh4ojgmr3hgC99gtdCx3W8Uz1-rjAcB-gY507WJL6AHun2Rw2bOrx_-BJZxh6IcEmlgLvo6JLTNnF5651XZVBsNifMvAaMMc2m3aYT23LEMZFUnvV6If87knyikKD8xYBq6U3BWdEE_3zwz3jtE4ma9TLXivRZdPfQKv_bso6SN8JYgS_-mqEdYBTDY6WYnW2HWzSugyoLnTPDAXqf7OX3_g5ezKC-zh4Aj0LGVNvAz7qJIIQimCtL4Al6c61wnYfH3HQNnKKzIZxkFo80_gb7DQ5RstZaRGm3HWFJAI9beJ8vJvR1VeXJ8_mfVgFm8_2RmgjBZOCM8T7_JmPI6onT7w0OlrwsSLciOrsdh2zJ4qwUzw0EWtnOSInrdRn1dGRYObcus_Fk2NJ6ZLHvD5dG1kC5t4vVTeS85Yhhe9a6SBsZm5FtcPtPAorz1p1MOMjKA4CqyWUxcvV5HDjntH9pn95HQkdzGGIkac5W0ki8XnlOy_VnjlHYlb9aaQpEkmfUWB1L90MIpTTRcdTvYwDc5-VmMkFZ6wOIxtcQ4DenwoVqiiSUY-lL4i4bEYa-NwyeZkxHVtOxlNEcTCUgVC9rXUk-Y6oloKVVudEP-NYdn43LJcq7erwAbkziiQx7VFHCCZLOfgwaWg8o1s_inyXxYJV6q1ybUD291UuczplHmPdDAozG3ewmD1kYvzNFwNM9lX5dlDEa8j-_RXyfgPVKz8jqMMAw0lqibx8az85aEdaxYWD_-oqHFF0kuNRCqhW81oJKCCJpz6pfn3yjcmtJ4IxWdL3Oyj9k5oMrN0yAE-YKo11AYa5e8IqaVYZsQ5-iiZAfvlkp-eC6flIsgVgGrq2VBLoHudn1LUcjo2udCwP01vTAHP_aIKD6frN7djNTEqpwCYXpI8_tV3Qy-la_lwq7jSzzLTdeZ3e7ynu86nvbeCRGJRGZt17MkMcCvBa5q-byCuIen5j_hDZeXBwMytl76-oCF1Xr_SFQ_Qnkvk_oEgnfuo19sQilhrWWUhY9352l0dFkW4YdKV1yqKyzhj2sNxXfjQBPIaOYWL8jJTX1loelWPEWbbwCQwsFDUCopWjqhHUrh2sUM7WCKlbpK3S-X8MwhDWsZpcyEiYgK2CFZQpTJLhv0LVjcuGK-im-KxnH-0R3b11V0C1WwZbXnSGQjUDc48cxDmoF47qQiiGP0JxpIS4q2WeOvlCFPhHZssDqmKq_qhz5dlpEVpg8IewukZqhiOGZwVwpxuDEVgvOJEsI2POjeAE0EU_vgAbDfCJNG1IBWvriE3SZ1hcy69lJm-1gpEEKWEOvM_nXRSlK6f7k9x20LwX2pJzzta3PWR2g67fQLqYfeIunvmWzLH2jtKcechbJe9OrXoNEKfFpDWSg2XtcGBZ0rrAr_Dvm33AzMVtwdIsePbj43OOpP6S0IepbU2EY8ONOTcNb1ooFQcLxwmcZxPCKPOcYXfX1jcOXcTuuDpgMMquwGdACnpGyK1Mu2ufnNp5_0WQt41UpjNd0wXaGMscLHlW0192CZNfZRpihNk-Wr55HrhF2XjYPJ3-mg3VCbLszDE1DodbtYGSBzyidIUfFsjSFES4B6zeclTPdf9giv9eAXsZi9pPyAVO2uezuohBhJWHobsEaXOeGRlezJpR4Zej9aAMoMmSofRhEdHU67cRMgUsg4j5ZQVR7-Wi1tx-Al7fNika5UPkmhSDtbO,
172,MSFT,2 Artificial Intelligence (AI) Stocks You Can Buy and Hold for the Next Decade,https://finance.yahoo.com/news/2-artificial-intelligence-ai-stocks-084500424.html,"For a long time, Microsoft had been known mainly for its Windows operating system and Microsoft Office productivity suite. However, besides its software dominance, the company is now also seen for its prowess in the generative AI field, thanks to its long-standing partnership with ChatGPT creator OpenAI. The second dominant player in the cloud infrastructure space, the Microsoft Azure cloud computing platform, continues to be a major beneficiary of increased enterprise spending on AI services. Azure's revenue was up 30% year over year, wherein 6% growth came from increasing adoption of AI services. Not surprisingly, Azure OpenAI Service is already being used by more than half of the Fortune 500 companies. Azure AI had 53,000 customers at the end of the second quarter fiscal 2024 (ending Dec. 31, 2023), which included both AI-first start-ups and large enterprises. Furthermore, Microsoft's focus on tailoring Azure solutions to the specific needs of multiple industries through industry clouds and cross-industry clouds is also driving usage. All these AI capabilities can eventually bring in significant revenue streams for Microsoft. Plus, the company is standing on solid financial ground, with $81 billion in cash at the end of the second quarter. Hence, considering Microsoft's sustained growth potential, this seems to be the right time for long-term investors to pick up at least a small stake in this AI stock. Shares of digital advertising giant Meta Platforms (and owner of social media platforms such as Facebook, Instagram, WhatsApp, and Messenger) surged 194% in 2023 and nearly 43% so far in 2024. Despite these gains, there are multiple reasons why the stock can prove to be a stellar investment in the coming decade. These recommendations are playing a pivotal role in increasing daily usage of its platforms among the younger population (age 18 to 29 ) in the U.S. This demographic is exceptionally important for the advertiser community, mainly due to its high lifetime value. Second, Meta is also focusing on unifying its AI-powered recommendation system across Meta's video ecosystem (short-form, long-form, and Reels). By leveraging a vast amount of data across video types, the company aims to recommend more relevant and responsive content to users, thereby enhancing user engagement. Improvements in AI technology will improve ad targeting and conversion rates, further bumping up ad revenue for Meta in the coming years. Third, Meta has also invested in AI tools and products (Advantage+ suite) to help advertisers automate the creation of advertisements. The company is also introducing generative AI features for content creators to boost user engagement. Fourth, these AI initiatives have helped expand Meta's user base and increase advertising revenue across geographies. In the fourth quarter of 2023 (ending Dec. 31, 2023), the company's monthly active user base was up 6% year over year to 3.98 billion people. Meta's ad revenue rose 24% year over year to $38.7 billion. With Meta's user base accounting for nearly half of the global population of 8 billion, the company is exceptionally positioned to capture an even bigger share of the global digital advertising market, which is estimated to grow from $363 billion in 2023 to $1.1 trillion in 2032. Considering these robust tailwinds, Meta can prove to be an attractive pick for long-term investors. "
173,MSFT,Microsoft to open new AI hub in London,https://finance.yahoo.com/news/microsoft-open-ai-hub-london-084327334.html,"Microsoft is to open a new artificial intelligence hub in London to work on its AI products and research into the technology. The US tech giant recently announced the creation of Microsoft AI, a new team within the company to focus on AI, led by Mustafa Suleyman, the British co-founder of AI giant DeepMind, which is now owned by Google. Mr Suleyman said the new AI hub, which will be based at Microsoft’s offices in Paddington, will “drive pioneering work to advance state-of-the-art language models and their supporting infrastructure, and to create world-class tooling for foundation models”. Writing in a blog post announcing the new hub, he said: “This is great news for Microsoft AI and for the UK. “As a British citizen, born and raised in London, I’m proud to have co-founded and built a cutting-edge AI business here. “I’m deeply aware of the extraordinary talent pool and AI ecosystem in the UK, and I’m excited to make this commitment to the UK on behalf of Microsoft AI. “I know – through my close work with thought leaders in the UK Government, business community and academia – that the country is committed to advancing AI responsibly and with a safety-first commitment to drive investment, innovation and economic growth. “Our decision to open this hub in the UK reflects this ambition.” He added that the hub will create jobs, with Microsoft AI “actively hiring exceptional individuals who want to work on the most interesting and challenging AI questions of our time”. The creation of the AI centre further expands Microsoft’s presence in the UK, which includes its Microsoft Research lab in Cambridge, and builds on the company’s pledge to invest £2.5 billion into the UK, announced late last year, as part of its AI plans. "
174,MSFT,"Trending tickers: Bitcoin, Tesla, Microsoft and Boeing",https://finance.yahoo.com/news/bitcoin-tesla-microsoft-boeing-trending-tickers-082845948.html,"Spot Bitcoin (BTC) exchange-traded fund (ETF) flows are anticipated to remain robust leading up to the Bitcoin halving, according to analysts. On-chain analytics firm Santiment said that Bitcoin ETF volume has not slowed down since the asset’s mid-March all-time high. “It is a likely foregone conclusion that high activity should continue leading up to the April halving, but it will be interesting to see whether a drop-off in ETF volume and on-chain volume will occur directly afterwards.” Shares in Elon Musk’s EV maker were almost 4% higher in premarket trading as the company drops prices in an attempt to clear out its biggest ever inventory stockpile. Tesla is offering the deals after producing 46,561 more vehicles than it delivered in the first quarter, adding more cars to inventory than ever before. Microsoft is setting up an artificial intelligence lab in London, in the latest boost to the city as an AI hub. The company said Microsoft AI London would help drive its work in advance “state-of-the-art language models” and in creating “world-class tooling for foundation models.” Companies such as OpenAI and Anthropic have also set up offices in London in recent months amid a race for AI talent. Microsoft said it would be “actively hiring” employees to work on the most “challenging AI questions of our time” in the coming weeks and months, although did not say how many jobs would be created. Boeing shares slipped in premarket trading as the company is yet again under the spotlight for safety concerns after an engine cover fell off during take-off in Denver, US. US airline regulators have launched an investigation after the part came off and struck the wing flap. Flight 3695 — with 135 passengers and six crew members aboard — rose to about 10,300ft (3,140 metres) before returning safely 25 minutes later to Denver. ""We apologise for the inconvenience of their delay, but place our highest priority on ultimate safety for our customers and employees,"" a statement said. Boeing is overhauling its leadership amid its most significant safety crisis in years, announcing sweeping changes that included the departure of its chief executive Dave Calhoun at the end of the year. "
175,MSFT,20 Largest Video Game Publishers by Revenue in the World,https://finance.yahoo.com/news/20-largest-video-game-publishers-022627321.html,"""For 2023, our net revenue from games and related BES were RMB81.6 billion, or 9% from 2022. Revenue accelerated even faster in Q4 to RMB20.9 billion, up 10% year-over-year. The additional growth was primarily due to increased revenue contribution from launch of new games, such as Justice Mobile, and sustainable development titles like Eggy Party. Revenues from mobile games continue to make up the lion's share of our game business, accounting to 77% of our total net revenue from online game operations in the fourth quarter, and 75% for the year. Youdao's net revenue for 2023 reached RMB5.4 billion, and were up 2% year-over-year in the fourth quarter, in the fourth quarter reaching RMB1.5 billion, primarily due to increased revenue contribution from Youdao's online marketing services."" A group of professional gamers in the middle of a tournament, demonstrating the high-energy of the competitive gaming scene. "
