,ticker,title,link,articleInfo
265,NVDA,3 Millionaire-Maker Artificial Intelligence (AI) Stocks,https://finance.yahoo.com/news/3-millionaire-maker-artificial-intelligence-111500783.html,"According to Grand View Research, the AI market hit a valuation nearing $200 billion in 2023 and is projected to expand at a compound annual growth rate of 37% through 2030. The trajectory will see the industry reach nearly $2 trillion by the end of the decade, suggesting that the market is nowhere near hitting its ceiling and it's not too late to invest in AI. So, here are three millionaire-maker artificial intelligence stocks to buy right now. In its most recent quarter (the fourth quarter of 2024, which ended in January), Nvidia's revenue increased by 265% year over year to $22 billion. This monster growth was primarily thanks to a 409% increase in data center revenue, reflecting a spike in AI GPU sales. Nvidia remains on a promising growth path, and earnings per share (EPS) estimates seem to support its potential. AMD was slightly late to the AI party as Nvidia beat it to the market. However, AMD is investing heavily in the industry and has formed some lucrative partnerships that could take it far in AI over the long term. AMD's earnings have yet to reflect its investment in AI. However, its recent quarterly earnings suggest it's moving in the right direction. In its fourth quarter of 2023, AMD's revenue rose 10% year over year to $6 billion, beating analysts' expectations by about $60 million. The company's AI-focused data center segment posted 38% revenue growth. The company has leading positions in multiple tech areas, including e-commerce, the cloud market, gaming, consumer products, and more. However, all eyes have been on Amazon's AI efforts over the last year. As the operator of the world's biggest cloud service, Amazon Web Services (AWS), the company has the potential to leverage its massive cloud data centers and steer the generative AI market. In 2023, AWS responded to increased demand for AI services by introducing a variety of new tools. Amazon is even using AI to boost its retail site and announced an AI shopping assistant dubbed Rufus ahead of its latest earnings release. Amazon is moving to become a major threat in AI over the long term, but it also has a lucrative retail business that makes its stock too good to pass up. Amazon's earnings are expected to reach nearly $7 per share over the next two fiscal years. In a similar calculation to Nvidia and AMD, multiplying that figure by the retail giant's forward P/E of 43 yields a stock price of $301, which could see its shares increase by 65% by fiscal 2026. As a result, Amazon is a millionaire-maker stock worth considering in 2024. Before you buy stock in Nvidia, consider this: "
266,NVDA,HODL VanEck Bitcoin Trust,https://a.beap.gemini.yahoo.com/mbclk?bv=3.0.0&es=AQAAAMUr9whCbfYKNrpt7HlUA-oA_Z7Q5sUZxZ5KTufznOFG7UQsFv9c2X2N-n0b1xvDghi7M0yxlHMS8BPWL9VPZ6sM8pqYcGZ0DSfy0B983dkgG-dAChzTQUhF8NBBIi041eF7aYWl6DRXQT1mmdlbsz7J6kofJsBhDc_15H9SRaWEaw1Az1KQ0UECdlf4lSgb8wMtKDDgvakTOnn7o_9NSDwXgb_kkPXOneA44OgLOFRDwXiDG6vU7tsWKI2lf4C-XFVtduJvhtyobB77ZrH_EaRGsx6kTmc9RkU3m314RHcE3KDrR2uGhI7txuV7WDPheAvySRqzCij0GZNnDC7pId85fkQTG83TUVR23V90OtFywhw-wMki04pOv9b2e4QWMX0z-bHzGWZXTeEcnwo5C7PSQfeM0JfSHxhREBI__3bUMjI3_UyjHmlQcvYqtpF3DGXrC5z0oU7GzLeDn_0FC7cqlmHqEFbltudUy45Dl9Yo1ZcRY3EofB49m0UKitHOxlsGHW049NvEuA7x2zL6vfWRbwzNgwSD-Q5lZP0uAls_QrDkZd8oWgpH-RXf7RXoUZUFHeTozkRE2_A9R1KxOy7AMwjliP9SRWPTtVAJgsHP6k7y5RK9eQ_NciW2WH2xmOzkVWZvvzsgheq_HuJWhaMwAro8UkT_8Dm5DGNXGVo3KKHiSJhyzwSecSZZCkASdYqXiE_uRE89RK214yviomSd61ry2wb5HP1Mj9HmFhuxUpWR-bd8lMs7nj3zwbxCIW-M6lN8tu0glfajgCB2JWNQJO7HwxJ6TZHl9bQkNf0qYVJNxENgbaYl5PXxFI8xRKS4JolevLB8nzBqDlY_SIARDHnzHk0_5mXJL_gKtQmfy3bQC8giYPrWAojq7QnQWjfp0sUNMGEV0ukh_Bu-9ErmvKOqiAOAQ7iuZlgLiTC3ffxxFju5ZZZONkT_IDVqpBFtRw94zKfyelbAnDTGlUj_mT_IZ8rzL-EbcuSBgXS6Ws49VjbtmAakHQBg7HWoekmbqhI2QU09Krd4-9uIZKaY5YDygAt2c95FhmcrZOo40rdiKyV_pqcwVN70VrKuSMdUZ_TOHGz_Id_SgeNOg7efvr5Bx3SZa8S8OW_4hpmKomE3tUir0Q4O9EulSUh-FjtOUFh3Ui5VgH_23hcmFoVMC1PdvoCzDFT6m6EXsAKuNFMD0-6Er4s14hz16JSt-Q9LEbfreGb-Hguk9dOgJlZkySUO10Hu4n8mRXG1_MGW2oax4520-Lv2FnwA-19RBif_Of7AGAV8V3QUSeklXv8yAsj_orqwhRXUiptGQKmS1WKpLLdu6p9Yv1Gy8hk0Ayb18T_vtZwxT-EYpUW3shD7ByP7dAiA_M5LAHE0onyV6lpMFtb6IPZVIAZ3dRGj6wRMyO88whimjmG3v9V1sHfY_LrqtuSsjrwKrL-yvb9eENty91OT6CN6L_ulXAJr3vNJrEKKy7S7R2oq_3XCGLxVgQIqLZvcdWrR-A5XhhnZfDH5yDkXQUZZwunHOMvNOrUY0QSnRoIX12mOqh_RzYmNG3QXF5LWqWGdLW8wpY9UwTVbXl2NwvYuFhFoqTRRHNeT6hD0tTn_uHwT_CgNRUEDT_9gPssIwEK0m7aeJlNNSlgMz2h_El0R_RO-UOhAS3N2xhnIyjUwniiiiOAgRkNiENQldF_eKEu2JqBezXIsxONsqp6MUqDO4M2Bna5CR9d6YxMhfBVAHGSH9V84wr9rQaKPvyQfN4_KOjsK0KodZIJZHrOxYHjD2gKDzT4mjf1fB1wczjBDLCwszgILiFrNEmguENSm11GebEjsF5DrhlMjQdYCFEklldzmrARG5rDf1yAaW9JRKYeMl6sG9xfAtJts1HGt2OmV2Jx9aRJtN05jJWv_yLD5U47Pzj3wY2WvvAfKENuZ_V_unCHo0BlPsXizCmQT5rgmobzdnPq8k1ceAeKazVSYj-WQhF-M21ElVxHWHQDvpTjz3-5ITRXSKAMsIX1Oz6TB4z6J4YmP5Kc5lo4ehLP_WKZ8-rcqdC-itqKcjOIdghERJ24WGKVkjvbxMVNrbKE3B2bUAgoC_rBa_rJd4N4E5xAPSM2tQsu-VYi6jOHwR1I1kaIcMuzNRmU2uXIDVa7VuhCUlDvTGcp3m5rjpODKMnGZJ1BCLYBwM1RZU3IB-YNqWvijMV64SnXR3GB1FaovcpkRpSY_8c5ZhcKBL4kiW4XVpGtd3YDJx12tCaRCy9jf_tgKvSHeY9N27DkPTiA6aoj5WdihsVicn68mnKYyN1OQNLyrhDHDFT6KThQMcdCLRXHmvy1TK-VGDKtP85mqI3yj2Do8dBp_KazR8-LSh4WMeQPLVhas47ain6nuKKcdBV-rQsPXJ2PKA0NJ2TYCz0RKDgnHy8B_eJwFM81u_P6r_vhe5EvoY2H5V3N0nAZptUIIVNGHvI_8NSsJUIzjqamMz7CGdyNsHn2pP4pmUgOqdWEHjDfRZexc7TnoFBE-luEi64uJYHVjqeL5RCahY9jAsHy99bIaOuLHUs7EacK-izGEkqk6hutkd9zh4_kgq2eQNEDME7NoSYz5m04ghodKjkO6MUeTPuKM_QfOAg5er3QqR4zmJrc0gG8jNvOyGyYwM8JACeV9zWoWCZHAcRLTQ0vzDWrzhLkblJTGKW6aAXSRYwO1-h7qBEKsyb46NmvYbJE030NVK8zCLlFMxT50a6erwXtwvHX5F0CcLadThwH9mIvDAKZSbaHKZVZSjUgEmjUUtWHShlxrOQ24nFepJPXsPAqQg1b7DQqp1fMjTbzAlTbgPuGD1if9DviwKqvFN1CuMY5Dh4qTsFNKUL340XQSaGhbLSjVF4pNeCGP2o963U5muxSwoO3m0-Agxycv9vK8DewOTeL-rJ4SkYg9Yp77A67mWCSwrbCEMmm7Zf4QbDU0PidscMb6AEDgzCTWxutBxPsN4zWrFZBdtmfc6m7U45nbgbBxkNGoaAdtBgDJrKvi2e2UdJHEPToT0AszRzc1YyDqBiAEkMnM-vsDS1az9y3g-4yojb0e1I9N2O3dDPCB4z0v6lvp9DIvqLeI6fyH3YYYDMRPDloeRQ_RTdRi8VFHlNIfG1dtJIbiLIFyJqq2BrfCJQ,
267,NVDA,3 Supercharged Tech Stocks to Buy Without any Hesitation,https://finance.yahoo.com/news/3-supercharged-tech-stocks-buy-101500335.html,"Some already have shown their strength in recent times, advancing even after their top performances last year. So, just because a stock has gained in the double or even triple digits doesn't mean it's too late to buy that particular player. It's essential to take a look at the company's earnings track record, future prospects, and market position. Using these as a guide, investors can determine whether the stock has what it takes to generate more gains. These days, if a company has a strong presence in the high-growth area of artificial intelligence (AI), it scores extra points. (The AI market is expected to reach more than $1 trillion by the end of the decade.) Let's check out three supercharged tech stocks that easily pass this test, making them stocks to buy without any hesitation. Just recently, Nvidia announced much-anticipated news: It plans to release its new Blackwell architecture, which includes six technological innovations, later this year. Among these innovations are the world's most powerful chip and a second-generation transformer engine that will help Blackwell support double the computing power of its predecessors. The Blackwell platform also allows users to run generative AI at as much as 25 times lower cost and energy consumption compared to the previous platform. This has helped Meta grow revenue and profit, and the tech company reached a new level of strength recently, saying it's confident it can continue to grow and reward investors; so it launched its first dividend. Meta is going all in on AI. Eventually, users of its products and services can rely on AI tools there to enrich their experiences. With all of this in mind, Meta is dirt cheap for 25 times forward-earnings estimates. The e-commerce and cloud-computing giant struggled with higher inflation back in 2022 but quickly turned things around by revamping its cost structure -- a move that should help Amazon excel in any environment. Last year, Amazon's revenue climbed in the double digits, and it returned to profitability after a loss in 2022 -- the company's first net loss in almost a decade. Moving forward, Amazon should benefit from its dominance in the high-growth businesses of e-commerce and cloud computing, as well as its presence in AI. Amazon is using AI to improve its operations, leading to cost savings, and the company is selling AI products and services to clients through its Amazon Web Services (AWS) business. Both of these efforts should result in earnings growth in the near and long term. That's why Amazon doesn't look expensive today, trading at 42 times forward-earnings estimates. It's a stock I'd buy with no hesitation. Before you buy stock in Nvidia, consider this: "
268,NVDA,Best Growth Stocks to Buy for April 8th,https://finance.yahoo.com/news/best-growth-stocks-buy-april-101000803.html,"Here are three stocks with buy ranks and strong growth characteristics for investors to consider today, April 8: Ultrapar Participacoes S.A. price-consensus-chart | Ultrapar Participacoes S.A. Quote Ultrapar Participações has a PEG ratio of 3.46 comparedwith 8.40 for the industry. The company possesses a Growth Score of A. Ultrapar Participacoes S.A. peg-ratio-ttm | Ultrapar Participacoes S.A. Quote PDD Holdings Inc. price-consensus-chart | PDD Holdings Inc. Quote PDD Holdings has a PEG ratio of 0.28 compared with 0.64 for the industry. The company possesses a Growth Score of A. PDD Holdings Inc. peg-ratio-ttm | PDD Holdings Inc. Quote NVIDIA Corporation price-consensus-chart | NVIDIA Corporation Quote NVIDIA has a PEG ratio of 1.19 compared with 1.35 for the industry. The company possesses a Growth Score of B. NVIDIA Corporation peg-ratio-ttm | NVIDIA Corporation Quote See the full list of top ranked stocks here.  Learn more about the Growth score and how it is calculated here. "
269,NVDA,An Artificial Intelligence (AI) Game Changer Could Be Coming: Here Are 3 Top Stocks to Buy,https://finance.yahoo.com/news/artificial-intelligence-ai-game-changer-100700408.html,"The highest level of narrow AI is superhuman ability. Google's AlphaFold has already demonstrated superhuman skills in predicting 3D models of protein structures. Its AlphaGo has beaten the best human players at the complex game of Go. Development is underway for technology that goes beyond narrow AI. And it could be the biggest AI game changer of all. Some experts predict AGI could be coming soon. Google DeepMind co-founder and chief AGI scientist Shane Legg estimates a 50% chance AGI could be developed by 2028. Anthropic CEO Dario Amodei expects AI that performs at human levels will be available within the next two to three years. OpenAI CEO Sam Altman thinks AGI will be built in the next four to five years. The most advanced large language models today such as Google Gemini and OpenAI's GPT-4 exhibit some attributes of AGI. These models probably fall into level one of general AI based on Google DeepMind's classification framework -- emerging AGI. AGI holds the potential to accelerate scientific progress dramatically on multiple fronts. It could radically change the global economy. It could also make some investors a boatload of money. With such a massive opportunity possibly on the way, several companies are scrambling to develop AGI. Unsurprisingly, Alphabet ranks among the leaders with its Google DeepMind unit. DeepMind has pioneered several major advances in AI, including the transformers that made models such as ChatGPT possible. (The ""T"" in GPT stands for transformer.) Google has also invested $2 billion in Anthropic, another AGI developer to watch closely. Alphabet could profit from AGI in several ways. It could use the technology to power virtual assistants that revolutionize (and possibly replace) search engines. AGI could be integrated throughout Google Home devices. Google Cloud could host AGI apps for customers. The company's Waymo unit could use AGI to improve its autonomous vehicles. That doesn't mean Microsoft won't be able to benefit from OpenAI's AGI advances, though. I suspect that it will. If so, the company would likely be able to monetize AGI in several of the same ways as Alphabet, including hosting AGI apps on its Azure cloud platform. AGI could also help Nvidia make better chips. CEO Jensen Huang said earlier this year that the company's chips ""can't be designed without AI"" today. Huang, by the way, predicts that AGI could arrive within five years. Now for a reality check. It's possible that the predictions of AGI being ready in the near future could be overly optimistic. Some experts think it could be decades before we have AGI. Even Google DeepMind's Legg, who expects AGI might arrive in a few years, believes it will take decades for AGI applications to be developed across the full spectrum. In the meantime, practical issues such as premium valuations could cause one or more of these AGI stocks to underperform. Over the long run, though, if AGI achieves its potential, Alphabet, Microsoft, and Nvidia could be even bigger winners than they've been in the past. Before you buy stock in Alphabet, consider this: "
270,NVDA,UPDATE 1-TSMC wins $6.6 bln US subsidy for Arizona chip production,https://finance.yahoo.com/news/1-tsmc-wins-6-6-093513309.html,"(Adds further comments from TSMC, paragraph 12) By David Shepardson and Stephanie Kelly WASHINGTON, April 8 (Reuters) - The U.S. Commerce Department said on Monday it would award Taiwan Semiconductor Manufacturing Co's (TSMC) U.S. unit a $6.6 billion subsidy for advanced semiconductor production in Phoenix, Arizona and up to $5 billion in low-cost government loans. TSMC agreed to expand its planned investment by $25 billion to $65 billion and to add a third Arizona fab by 2030, Commerce said in announcing the preliminary award. The Taiwanese company will produce the world's most advanced 2 nanometer technology at its second Arizona fab expected to begin production in 2028, the department said. ""These are the chips that underpin all artificial intelligence, and they are the chips that are necessary components for the technologies that we need to underpin our economy, but frankly, a 21st century military and national security apparatus,"" Commerce Secretary Gina Raimondo said in a statement. TSMC, the world's largest contract chipmaker and a major supplier to Apple and Nvidia, had previously announced plans to invest $40 billion in Arizona. TSMC expects to begin high-volume production in its first U.S. fab there by the first half of 2025, Commerce said. The $65 billion-plus investment by TSMC is the largest foreign direct investment in a completely new project in U.S. history, the department said. Congress in 2022 approved the Chips and Science Act to boost domestic semiconductor output with $52.7 billion in research and manufacturing subsidies. Lawmakers also approved $75 billion in government loan authority. TSMC Arizona has also committed to support the development of advanced packaging capabilities through partners in the U.S. to allow customers to purchase advanced chips that are made entirely on U.S. soil, the department said, adding 70% of TSMC customers were U.S. companies. TSMC CEO C.C. Wei said the company would help U.S. tech firms ""unleash their innovations by increasing capacity for leading-edge technology through TSMC Arizona."" Commerce expects the projects will create 6,000 direct manufacturing jobs and 20,000 construction jobs. The department said 14 direct TSMC suppliers plan to construct or expand U.S. plants. At full capacity, TSMC's three fabs in Arizona will manufacture tens of millions of leading-edge chips in 5G/6G smartphones, autonomous vehicles, and AI data center servers, the department said. Through its Arizona fabs, TSMC will support key customers like Apple, Nvidia, Advanced Micro Devices and Qualcomm ""by addressing their leading-edge capacity demand, mitigating supply chain concerns, and enabling them to compete effectively in the ongoing digital transformation era,"" the department added. TSMC said in a separate statement that its Arizona factories aim to achieve a 90% water recycling rate, adding that the company has started the design phase of building a water reclamation plant with a goal of achieving ""near zero liquid discharge"". Commerce last month announced $8.5 billion in grants and up to $11 billion in loans for Intel to subsidize leading-edge chip production from the same program. The department is expected to unveil an award for South Korea's Samsung Electronics as soon as next week, sources said. Commerce declined to comment. Samsung did not respond immediately to a request for comment. (Reporting by David Shepardson; Additional reporting by Alexandra Alper, and Ben Blanchard in Taipei; Editing by Jamie Freed, Kirsten Donovan) "
271,NVDA,2 Insane Cards Charging 0% Interest Until Nearly 2026,https://a.beap.gemini.yahoo.com/mbclk?bv=3.0.0&es=AQAAAEnE8a3f57KtdPfuLSdyDVOXrsvR5axiIPs4F2RMoXxvEzJeeUptYnhecAVIVdavhDNeuH_gXV2kOvLU-P65tnmmLfwLLTpjwyuWfw_1A9fWWXKEoOr38OQ3o3gk1DCSvnLcy1b8QrBabtjXtz_36m1dWJ1uvM2v2sBaoMqXiddOOU1NUQNL0Hsb9mC2Nugi9haQv_7J7U4_Mmxp2OPL1J4IQ0wpDsmQpyjenDICziU2Bs51wQZ2u-HQZOi-NdCZLo3z4U0PJNihbifkD9xUD735jw7WHGxVdZolht-eE-zeeGJXOkIP1LMmb5vGMHLgd609X_929waj4LFaoOeeS2jbjDVzqzaLeDhDTh-ThycUk4AB_IaDV2MVd-xiCyn18WZIfdAuZhrsxv3X-dszMXSkHHBDFWJVr47sc4SFW6cI9e8GPNHOEOHWv2N8CBQYF_CXBCuE9bPCaX2lCB_uX-Pn8EccqJyWRdqkKcMu1hhGm9LUOQF9tVZjdzo9ga9mmKSvHRSAGDUignlq7H-QuF6BAuGj00YYES-rAAKdiOJRtf8JQ0qja3BBzi06nTplKk1iDcr-SDWaspBfiJe7oecge6-idjOgzVqACWpkJGvQznSFkaDDrEHRDMDdi-nYmf9WjvYKb89IBv4ThgIe-qxsRGlnU62Rqn4UHkazDNfQlrUs0X8rR95crkdMAlJ9-9rVEnyg_Kil6Er4Iuc2-S4apa996Yq1Wj8mGgCaCErBn4hfbMbnHkZDZsmPKl5gvmKyQGx5lupTuWNLruTCatzEj4IrI6G5yTIsQA440FpzMjBY_mMTKcijbTRKwcIJeCOGtDijHR7QKWZmInryLBx8z1tQLAhIl8tTBTAq3bga8H2zNXKE5FiheoD79dXWd1k1ZUrcTt5FDMsIZ_WyccUN9FyhOeAy7BOiz1UqTQ3WPCsFCO2LWVSYdN8NhNGrYWNLSqkVIZv_Kw7vgiP3kTGryESOK_tBH3MUjlFKCamCurdOkAkojcBjuci2ym8TDfscb5ys2E3n0OdBF7qOy6g9lCoLv82gVW2rPpfHN1zrGtxu3gEbupsogYbwBKI5eHOBzFAhFyWrvQg3TPCxEqTrgSeBT7gUJRfn0W7QT8Yua4AR6_pUhroQhqCSavEnwqQssNdO6MargsvvJqcQDv4vHmu1y18uDSwfTbc983W1dfj0OqI5C33rhH_Aa_4kYWUl4-gn_2P_OHRShRhhmtNdOjD2dYG00KQmF35GWjOs2bL7hlhFTsL2Gy1Ct1_mci48dEmCNCQIYVw1XsaOwZNL77nV0EFoX8AkixaxVk0CJDUjKPCl2h9s3wDI8D6aawjSyCGrRIVpZBM_MrcvKSsJF2mbPGT9MwB64TXMPJw8cnfkRnG-5SIoo3ka-Alism4zioZ9-ZHNWJpezn_8fsaJTsRDVuKO57fFzTwNNzcSPBjnCYZIYOZ5CWa_ZNoyPQFuHBv6M7DKlZy-IvyV2hlU07JqIYbU6CBy9xwYSnowfYixVvFHl6cq3OPFc1eX0LUhhYfMop3L-290Tylej4uSOR89L1voqgMwFQ62lKMgZiMzP-dCZfh0Glj6tmzR7cqZ9asEEPy5tdmpFRC_Wrwb1BDF8rVCWc8qbGZvlqVs9NlseBvvjXUnF21-QvbgBphec7YaObX7hoLFofgBTL_rtBcqA7rxZePfwOBe3AB8n1xq6TgEejCfXNmItVwUCZlhFbtTYYTbncrZqx8-0l5nhbi9se5AJzYcur4ARs4WJkEhOkRrKKH4tc5VpdYE0HGxapt0gYmfFZIMI-D__QD605HMOlsSt2V0UEB59EDjL3ys6BnF1BftVfWV40oDHUf1MVxLuiYzdQ2jAgPtjTx8GB5tulo1pWL3oYgG-h7AYdMcN_PPW4YUAea1djX305vcTLKC4odnA85bvJi1o3NzuUdVX8galdrAs3SgwLrxbQpePltnBw9QSwSa9WC4l9CjgmTS_qJ6lz0t_hW4QjGHxG5aRtxv3q0SFTApzBoQHlvSfwuayuvZC0X9RsLO9PpliKVjff6lhCpsPXHfV5WSBDIdDFitttodUq2AcL4c7gOMgBjDQouq25k651YHP6P2iVlrnOLJ0SXwXzYMxHYl0rZF-qiW_x-435mQo_8Kl_VgPPw4esHr5PoqftfNTGubeEHsjOZtaSFbX5slRdfuJWQgW7TMtUXjh81dteVcy8_G0SRpP54Y5l5Dhk0OLhvMTPG2ebxfkKL4piuQtWEbDwR7SCXbquK8QMx2Pq2bvbZZAtrJhYtwAJYBqtvvHvBxgW4AjG7WUv0CefqWeIYcwwvCsA0omGGiajKlGOhrRCWNoFYF8OCMTekSSPELIV5AEqmBN87Jqhse7065Ia4MQd3v_I09SZjsfGbLKQOCNvbb-JuZOXMxP9r6F5UOJ92w8LC_fJ7KLIYyD44Yd6nyXoStiC3BfwXXO_T9bO1nhmvsLNAZEPJDAFKvcLP85A-hD9053tTZNSNXMQZ50PW2RuMclXn3dkhKtPz_93aWukQyy-ap8t9A9EOdFF07wkOMyJydzb1e1cXP8fGIJUilQI5ERi-jpbW6lRfgWU0VvcD6h9QaKvK46-n_jOnxYDJjt7uYA602F1fxV4SPb7XME6qwCJ0D6uAQW28SZUs-YTvm2aKplnBhmIESuia49duxC1npwdQQCd2IDa8eWlCk66G03doyV552OX09oOEJaTFHdZHYrsOtokr5tAmbHkHN9EpL_vvstgB5Y6mTpmYzLU9HmZIXwvX8T_UopzTkdy5wbamKw6vkbx48U0wFhVEnaTnUmb6gPVKJRg7irZxn9m52DVjF9z4IAYnMpXLgW3-NbGHSF1oeLpJNWDETOqWbK9ptbE5fbvRmWgH90tAWNFShmJ680pXkmCV_QJGyJDb8hZGsZnROfbIsse2B9XunPx9FxtiFxj9VuHwTBeDDLuO7HY4oNAF33hicC2YelJVcyE77s4O0tRX0VXSnQ05p97QosMT5rfAOoiVg0lOWrJwQvbOaWB9_4XZMbDeMMdGlSUnwFK1QAZ07XgwCr7-5DwHJxUgQe5Do8HwPR0gNH0WxL7lQrj0TipmPtiPKGH4KHKjJ_nbJ8V5ZbveJUFgY_Kr9HrOEbfXMRyg_nDjMu2N1b4azxZaZn5m4Zwu5eomin-bCGLTlVaEHngYJK1PTEp-f9UrvhaOgmE1fCF2AgZAt7kIiLma2y6bO5-lNuV1Jvrn6dya0O0TXy2o7Ym2I_SsieOC5rIrLmPRE9YUw07fNDVB4W6kx_kl1nXrea2zL7wrvldDfx_94iUdhTlIvqdonsCU81f1CTqke0gEgMBp3X8ymDczexcMBhO21RJkhCA0euAlpLua9Hu3xlnA7Jyhqqczclc4yv2JXDTEP6ctQDwbGhnsZdbMwEWJsS_TRQXvA8KWYlWVWSJLGsHqo4665HKtUM33Z8ujtLr_W_7WwtZZaGai5hHk0vZHfhOx1WtwRZ_m9uT4gJuW75bIA5f4Ijwn5ApZ3rDPkxu3_PTr3ygDjsdSQcUMI23c2X0b9wsSDlHFdDfkHDUB43fqkR5PNKTHQRtwv-KeW8TzhhxJ-4jsNHiTobx6T9RNstsjiyIFRNLbemHO26rwzN9TJj1Km8qEormQ,
272,NVDA,Q4 Earnings Roundup: Qualcomm (NASDAQ:QCOM) And The Rest Of The Processors and Graphics Chips Segment,https://finance.yahoo.com/news/q4-earnings-roundup-qualcomm-nasdaq-090847651.html,
