,ticker,title,link,articleInfo
0,AMZN,"Looking for a Slam-Dunk Investment? Put $1,000 in This ""Magnificent Seven"" Stock.",https://finance.yahoo.com/news/looking-slam-dunk-investment-put-160700853.html,"Before you buy stock in Amazon, consider this: "
1,AMZN,Switch and get a 5-year price guarantee.,https://a.beap.gemini.yahoo.com/mbclk?bv=3.0.0&es=AQAAAIJbfYLMqkRDL9p9nwOH8i42MapRwltN7XBG8-NfA02i5HbDknv_zMb04LEMIsWcKHKHTLfYfrpJhPi_2cchDPChkwNM7FJZVjilVf9ZDi6m45neYp88xJtLxuSwvKCow_YTNa4EKpFcece117qWNIGYYoS3ZfRtW2qaeAL7T6tv2UCyCekLQQbNopoAJzPkOpC0Jjpwf7SoHQJNj035kLBzdOiJ2ZGzTlwXKd_KNQOAgDVK_1LY5HKi2GVnB3NQTv2KuG5AxqKa8dwhZ8uan4C31mDED46r5J9r2yrdqzdhqjsg-SR2nBmgsHFcSqLb0t24xW7aUtT9KU4CPWMLGJqDcuWldk4aM7LEwmySgFMxxHKk_pHpKQr1LKLSM_GsTUF94u9vJb_jxwvk3QlM84IpKp8W1ivpDwWpO_BAtUT8sYbDHdi72Sne-gajJ91wABMeKluke01UEtiCrQRXWQfOcdSqbklJN903tcbqFE8v5Q27hWwXann9PklmTyhPXlykWyFLOi_60hNuAdcunh3wwADAUpvJIu9xe0bxvJA5ARFQBmK68ZohlxljjMnuHu2pRHF8SCGOxlHQFIwb0fQFHAvUG7dVn15Ya3VD946vNHy6naYzABha_AlllmRIwzn86qdjpUq3eLUwuBNY3Hp94T0D9MwsOtqXalyOVb28x_64uqaw-uQRDrEOh3-LF7tKbrXNx21ou7mORhFJRcSkBGhdWuXGyp7c490eWd8wqPJbDiQo-vM5Zoil0PXGIEppRnKR5sj_s_NXLN71fScPxEohaxtbyb7-zFlHdDivbbZWaDAB4xzoaZ59vdLO0sCQwyCWkp1PdKIaSB2opyA_JMGSQndday7FbmPGD3LY_Iq8uTjLgh7M-KsIHOBs6RDDnquMhEeczUGhdNDoiamj8f5fb41lLp_PucUrukbnqVGMm6c-2sMdQFNVPrC6bEcmEXQ1yjFiHeabY907FBSxxIx0bYRp8cUG1tcsSWAsx3zqTX0qNdO2fhlp1ONXbs8eTDSoobwzJjySdeiPPK3N_YXOddZan688eAXce7yx1eNsmodC90aDhnKrM73vhOAQB0fEJoaZyBIR7zjekX72GIT9kaOhB_ySqhvVJztDEULKj4BAOirOv_V-xjZDybkSUttolRj-Qi26a03j1Dsg9I8zEWzTkz2r1Ghy9AuWhuFgAi4oUceFuSnWTd5qLrEGtlIFNSiffgZ065Ju5hceG9GDHHfocOdjFaTxG2J0bFYroEHgwQD9i_mdnWutNGsTedKXO_vCiCb0dztNIohcvOwJW0pmsb7_C5AyzipHLHtLKSOwrFNW1BGiDD9x3rPE2-XNu2yAuEzTpHAYJ_NX5mvwMY1dcgYCRtcvOBY9s9QTzu01dZx_2s6Ixc2KxXJm9B22gwWGKABKHxtIlq2677UbEvgm9vmhuyxsz3usOs8MIO6P24ncraKJAwiAAntA-IlFNGebttAoJ074KRXvgqCd-fJgpro0HUzj8Si4cErpmYkrCfmrM266b3HDx4pBXG2tjooZpOwTK494qqL3XJ0ZzDp-3BEcRJw6RTcAw5_5QiOUUTmkSIHccIbTGl6wiT58gfRIzag5lQly-uo1HIJtjjBBiq743J3eLh7uZiDqPzvu-shy-QYuacFhKnNmrWcvV7dK30oItfcppE5XjUzFmXnZR7hCzgllPIxcdTS-XnCvTryzZRejvYDDg9iGYdvdL7-ocJwwO_Ah5gMPei2RvSyXaGyPVs4U0duyq2lk2Ux14Bv5DTzpHOarcfpoIpTlVjH410OByiCY6VRAm8nZdr9Ffae1NkQK8YSUJoL3xzExjbHNidsYl8uaZ4e9iFycLz0_Yl4sfK1-zjqHUxLy8rOhlpff7gbdnQ2nIMeOevhxUheyEh9F8HQDhmykxTMHXZFCjaJWr7UCmv7dJ-eCF1nFLFdryrhMtCAUoSE7CIrQxTmqB--CPFe_asViihWxx7HFPsQVt_iFbpQ7_ZXSR0KdKtLNpbYbJZMvWgA8pHI4_cLNMTQBDypb8HTSSkOR6oY81-SSzN0shwA2cVMtAn4mIda_ypbQWRsZnWZrmTdzJos9s9TrnC-Ce5suGCHtQcC9SSk_3f3cwkG_u6XUNZkvEdITg26EXvJByIr5B_EwHus5OJzwq1iCwaCN5o7oCYqATlbM1ocuPrzfPpkrBm1HSReb6gb_Gr9LjS1EsASqq2IMKVsd8e73tq1dzZaCW0hIfQ5oerqTyYVdCaFXqWHj5BfQMYzcw2eO1p2gB6tMmgalWBL_McKplFELhLp3ox0gxqvTsjn1i95awkwdoZrGpaR0J8cdWZoieRPfeDxSAmGYb4UigeiZ5ygbq4Gb02XWpxXFXH9SdR-4S7V_0ilevpXm9Ip0Y5oZGV-BnlksDE6mOaqHp01lbXcyCqU-rBd3qZ2NA9TUJYmR6PMo-OHNCH-O8MMdJUsKlOUklc28BQ4PuD0CTGb0i7JcQQDI4tE156Y08NeuTshoXHCXEmDzpVlLrRTElgkvqvMZXMKcCmiCZoK2jlUF6g0Y4psF5v1Cf641BvwbTZURehluqvdqZPuB3F3j3CldGQt5ZAZfC5kIYo7fnv-DAMf5Oc2AXxxY0dbB2WQzF2jygS3U5cX5rK6qCWLuq_2M1qDpSD_gSKwXZUuvWJueJZ4GffdL59pvpvD3QFdTyxCSUIwl1trkHf-TJveAMxmhhQcex-dJSyu-nz4FWIBmjQ34pvHshHn0CGiNjQmnStFI-OWqy6K6s2z7FpeuxtqRB0tUtiwhJhe6DV6_lCOk76aBrJ7KfE3Qgx268Dyf1LXPDMTNWV7mZg0u6Z4PSWFtBJ2037VVu0CdYCSrPm9JkrJuaGqwxabf7GfvPFVINMsGRliBFLMXsNthmDuAul7TVXcGmZT5BxbXrKqyvQmHghfYK3A6yxTGS64KCrCqcBy5_pLvCJyXkmphexFvStsTkkl1XVTLZdjTNR1npbgSzQpZ7ch0dQbpHlZgVHrLbDikxroLb3xwohDEqKSLokhrhl3Dmzw6JfP4xLAKXoQGsqV_se4d_IuiPvawcjP3crypfOHrjvjUnLpUwIGFoE6GdyxrhQyJqv11fLtqpNiSgWQlo9lNRTyoLE4wkAqZx0Z7HQ6YJYptcdgnqJmGi9TdcL3_ugUdoHz716NRBb-DYS7ixtoLLBLZRWvF73fI_nFBe18,
2,AMZN,3 Biggest Value Investing Mistakes,https://finance.yahoo.com/news/3-biggest-value-investing-mistakes-143700118.html,"(0:30) - Learning from Warren Buffett’s Mistakes (11:10) - Stocks To Keep On Your Watchlist (26:00) - Episode Roundup: IBM, AMZN, CVX, BAC, AAPL Podcast@Zacks.com  Welcome to Episode #363 of the Value Investor Podcast. Everyone makes mistakes in investing, even the world’s greatest living investor, Warren Buffett. He’s been investing for over 80 years so there are bound to be a few blow ups along the way. What can we learn from his biggest mistakes? 1.       Buying in a difficult industry where there are few moats 2.       Holding the company too long, even when the business has changed or its not performing 3.       Buying an expensive stock Berkshire Hathaway first bought shares of IBM in 2011 around $170 a share. By 2018, Berkshire had sold out of the investment in the range of $140 to $150. Berkshire took a loss. Buffett later said IBM wasn’t performing as he thought it would and that’s why he got out. But it took him 8 years to finally exit the position completely. During that period, IBM’s earnings fell year-over-year in 2014, 2015 and 2016 with little rebound in 2017 and 2018. Should Buffett had sold earlier when falling earnings became more than just a 1-off at IBM? Berkshire Hathaway bought Bank of America in the third quarter of 2017. It still owns a big position. Earnings at Bank of America popped during the pandemic, rising to $3.56 in 2021 from $1.87 in 2020. But earnings are expected to fall this year by 9%. Bank of America is still cheap with a P/B ratio of just 1.1. Is Buffett making a mistake in still holding Bank of America? Berkshire Hathaway first bought Amazon shares in the first quarter of 2019. It’s a small position in the equity portfolio. At the time, many were confused by the purchase because Amazon sported a sky-high P/E ratio and didn’t seem to be a traditional “value” stock. Amazon is cheaper now, with a forward P/E of 44. Earnings plunged in 2022, but they have been rebounding. In 2023, Amazon made $2.80 per share and the Zacks Consensus is looking for $4.08 in 2024. Shares are up 105.2% since the last day of the first quarter of 2019 through Apr 2, 2024. That’s beating the S&P 500, up 84.4% during the same time. Was Amazon too expensive when Buffett bought it in 2019? Berkshire Hathaway first bought shares of Chevron in the fourth quarter of 2020 and then bought a bigger position in 2021. At the time, Chevron was dirt cheap on a fundamental basis. It remains cheap, with a forward P/E of 12. Chevron shares are up 90.3% since the last day of the fourth quarter of 2020. That easily beats the return of the S&P 500 during that same time of 39.1%. Does it pay to buy the dirt-cheap stocks like Chevron over the long term? Berkshire Hathaway first bought shares of Apple in the first quarter of 2016. It has since become a cornerstone of the Berkshire business and is the largest position in the equity portfolio. Shares are no longer cheap, however. When Berkshire originally bought, Apple was trading around 10x forward earnings. It is currently trading at 25.8x. But earnings growth has stalled out the last few years. Apple made $6.11 in fiscal 2022 and $6.12 in fiscal 2023. It’s expected to see some growth in fiscal 2024 as the Zacks Consensus is looking for $6.55. Is Apple flashing the warnings signs that maybe it’s business is changing? Tune into this week’s podcast to find out.  "
3,AMZN,"Amazon's AI Eyesore. After Just Walk Out Fail, Should Investors Be Worried?",https://finance.yahoo.com/news/amazons-ai-eyesore-just-walk-143000045.html,"Amazon has pushed back on that claim, but the company does seem to be largely stepping back from its Just Walk Out technology, which at the time of launch appeared to be as disruptive as anything else that had come out of Amazon. Licensing it to other retailers also seemed like a viable, potentially multi-billion-dollar revenue stream. Those hopes now seem totally dashed. So what does all this mean for investors considering Amazon stock? Let's dive in. Whether or not it's true that 70% of Just Walk Out transactions were verified in India, Amazon is pulling the technology from its Amazon Fresh and Whole Foods grocery stores in the U.S. A little more than half of Amazon Fresh stores had Just Walk Out installed only recently. The technology will remain in the Amazon Go convenience stores. Rather than using Just Walk Out, Amazon is leaning into its smart Dash Carts, which have a scanner and screen contained in the shopping cart so they can track your purchases as you shop and show you how much you've spent. Amazon sees these carts as a more reliable and practical solution, and they give shoppers the ability to see how much they're spending as they shop, which Just Walk Out does not do. Under CEO Andy Jassy, who took over from Jeff Bezos in 2021, Amazon has focused more on cost-cutting and driving profitability rather than innovating -- its historical strength. Scaling back the Just Walk Out technology seems like a logical step under that regime as the technology was not living up to its promise. But it also represents a significant failure in an area of artificial intelligence where Amazon seemed to have an advantage. Other signs have emerged that call Amazon's AI strategy into doubt. The company just announced it was cutting several hundred jobs at its Amazon Web Services cloud computing division, a sign that growth in that segment may not be living up to expectations. Before you buy stock in Amazon, consider this: "
4,AMZN,"Amazon.com, Inc. (NASDAQ:AMZN) is favoured by institutional owners who hold 62% of the company",https://finance.yahoo.com/news/amazon-com-inc-nasdaq-amzn-140022347.html,"Significantly high institutional ownership implies Amazon.com's stock price is sensitive to their trading actions A total of 25 investors have a majority stake in the company with 46% ownership Given the vast amount of money and research capacities at their disposal, institutional ownership tends to carry a lot of weight, especially with individual investors. As a result, a sizeable amount of institutional money invested in a firm is generally viewed as a positive attribute. In the chart below, we zoom in on the different ownership groups of Amazon.com. Many institutions measure their performance against an index that approximates the local market. So they usually pay more attention to companies that are included in major indices. We can see that Amazon.com does have institutional investors; and they hold a good portion of the company's stock. This suggests some credibility amongst professional investors. But we can't rely on that fact alone since institutions make bad investments sometimes, just like everyone does. It is not uncommon to see a big share price drop if two large institutional investors try to sell out of a stock at the same time. So it is worth checking the past earnings trajectory of Amazon.com, (below). Of course, keep in mind that there are other factors to consider, too. Institutional investors own over 50% of the company, so together than can probably strongly influence board decisions. We note that hedge funds don't have a meaningful investment in Amazon.com. From our data, we infer that the largest shareholder is Jeffrey Bezos (who also holds the title of Top Key Executive) with 9.0% of shares outstanding. Its usually considered a good sign when insiders own a significant number of shares in the company, and in this case, we're glad to see a company insider play the role of a key stakeholder. In comparison, the second and third largest shareholders hold about 7.4% and 6.0% of the stock. Our studies suggest that the top 25 shareholders collectively control less than half of the company's shares, meaning that the company's shares are widely disseminated and there is no dominant shareholder. While it makes sense to study institutional ownership data for a company, it also makes sense to study analyst sentiments to know which way the wind is blowing. There are plenty of analysts covering the stock, so it might be worth seeing what they are forecasting, too. While the precise definition of an insider can be subjective, almost everyone considers board members to be insiders. The company management answer to the board and the latter should represent the interests of shareholders. Notably, sometimes top-level managers are on the board themselves. I generally consider insider ownership to be a good thing. However, on some occasions it makes it more difficult for other shareholders to hold the board accountable for decisions. The general public, who are usually individual investors, hold a 27% stake in Amazon.com. This size of ownership, while considerable, may not be enough to change company policy if the decision is not in sync with other large shareholders. While it is well worth considering the different groups that own a company, there are other factors that are even more important. "
5,AMZN,Amazon Eyes Record High as It Rebounds From Post-Pandemic Rout,https://finance.yahoo.com/news/amazon-eyes-record-high-rebounds-133410160.html,"(Bloomberg) -- Wall Street investors are finally doing what analysts have been recommending all along: buying Amazon.com Inc. Most Read from Bloomberg The shares of the e-commerce and cloud computing giant rose as much as 1.2% to $187.29 on Monday, putting the stock on track to surpass its closing high of $186.57 set in July 2021, according to data compiled by Bloomberg. While fellow mega-cap technology behemoths including Meta Platforms Inc., Microsoft Corp., and Nvidia Corp. have breached record highs in recent months, Amazon has lagged the pack as it nursed itself back from a post-pandemic selloff of about 57%. The stock has long been the most loved equity by brokers, with 67 analysts urging investors to buy and the remaining two with a hold-equivalent rating. However, investors have looked for more than just analysts’ recommendations to come back around. To win over investors, the company has been relentlessly cutting costs and restructuring its business, while demand for AI is also starting to boost its bottom line. Amazon Web Services, its once fast-growing cloud unit, also showed signs of re-acceleration in the last quarter, assuaging some fears of a demand slowdown. Morgan Stanley analyst Brian Nowak said that that upside to retail profits is giving more confidence in the e-commerce giant’s ability to deliver strong Ebit and free cash flow in the coming years. Nowak hiked the price target on the stock to $215 from $200 in a note dated Sunday, implying a 16% increase from the last close. Analysts on average have a target of about $209, according to data compiled by Bloomberg. Most Read from Bloomberg Businessweek ©2024 Bloomberg L.P. "
6,AMZN,Top AI Tech Stock To Watch,https://a.beap.gemini.yahoo.com/mbclk?bv=3.0.0&es=AQAAAK_iwkzh211cWVgjekzMy7UaAxpRk0cL0goDKp40tFACD3e2sTihPXLVjlrUjQsOfiNoK_pctvVGZuSBZ8WN0JwEZhUGhRYq0HGsYdcHYOseZV-jhF9HLkzeW-ig4JVKSGdNJQ_7Hs1Er2ax8pwGivZiJsxNRf_crKCPJdnoVi4fXSludQ_djx3wk-GQB7d19AYgB_nUG87Bxy4T7xznCEImbF15epx7bqjiLKtNkvozKAoJ0DVYQ9UdxSP6Yg2k3PVCNkK2GhOob1-Dt5yVBOvzstNYaboNBnQfJHXm_xNzlmoVSIyoEgwc0ZruUfu_GMz1V83eeSNuQiMYFYDoMBmJX5C4zcDrhYuh_YtUDyZyiAj-uccMQnFYOmxqCymU53ildEaf7gaevHeqT4zoHNnvgPeYGMB_Cv0DJzhs0RAG_8bRtmj5aQUhPxFkMqGidh-ZXCkREyfS6L4YQ6iKYKsxZg9lc5jAq5quk1HsjrmwTMB1kc-wynOUzTVdX-b7ZE2hltzKET5c-1yLhfPZlUK0DmawaFoLuQKfs18BSVXCs_zMEjkGtk0NuSZqflILrK-2oHos2KuVVEGQe_V1szlKIhbqdLhHTTMemH1HRVDNbvoswO5TYUTkHzwgMGk4CTC7ej2WIt-HIjCfK7ZxVoyCqv1Blstf1c58YDHZNb5Xw8l2wte6AOmP4pEKVY0_r7SP3AQqjpHAG7kqHWfro3N7rLAoMD5-z8LYfX7dUuwQXkvC73zgVJ1AggiBTqjAhTpKny6eDXiwtJi_FWR0iAXho9yVdxOdEN0T13L7WIbhH6mdcPGl3Qy-CBYVfoWuleOhDwMK9zANiLtm3v3xMDsR3B_R1leZNX0YWx1ol62qAKoHtwSayj8dcU5pPsek__STXHKiBv01hrrZV5pqPDjwX0_shoDQI-w3ZR95SGhCUdM3noYz01VxREORXcsV-nWYXSbB5SPiLIuUFgvmtxW6qPqNLVMZ9EBEaUHK9fZyDYongcDjls2hMLeK6Fj_Kul42MTkxUNipaRgOhB5MEGt__BkHNyQAs9TLqZdiXoTPbmMNGRLQbuHQrVpP5QcNKLVNkffHxSavOpYzLlvnT_syN3UVGv60nbi2hpxLkdm7sPBZIYzzZempEAKB6vOnpT3aKHFy7dDSQG5olB6bXJovKAaEnln8ggcpwaSpYxqJ5Hu7Ss8vfEFLX4hoLxvvSbW-2-75NGV6Vl_SIVTS4KX-3SXnuxeYpbGmdrTuRbASZT2nVD4Yv-npL4BH2NM_kj1ZvvIkkvVm0iG_FQCPJM8cnc0IUYxDPReDAUwV6Vtpn0mOOpEIXAXh0RJ7VhkDLET71YuIYHHscVhL_nR9xbrLMYOdQrwSjKSP9qUWiVg5K0BhOtlSefFyjosAOcVxx7-HG0MCQWJ-17OVgDvM1f0b50_JATKNDhvrcqrB18HqDDUL3A6IRjxghdfUEUzM3qa9UqVx8-MP9Ea3PMmoC_tOVd7C4XI3Nevxj7O0Spw1Jii0451DtBII_PSINf2Ppe2uNey1WNpWckxGqGe31RVRZhHy6vH9vetOhaoqxNLePkTsy2I4216-QekZD4c1wWZVj_NpKGUP6rc87MixNj1ZnDsIcmwdmsNEZaX50w2_2srOlj3dyLDyeOpBaYC0JA8YXBg5M-Fl8Xc6BGGRTZA86k09DVpdyYM2Ow-8xnQnTM0DnRtGxV4WbiDURu1SqWEaqu8uzW2nTP1zBTGFz1PtIdg37XfObjZemEi6etKO4SwU8rVGzSLChfCTbtC58OVDoZvrOKDB2VVos9iwr1ybNZ9hz1bZKDlXJcWVdqI4pQTBEG38oUpKWhu4iSD29PvZdxHFG4ZN30SAFF15fB4HKfqNjQZl0ChW-aOW78hGYhLPerkF30uxtSuQXRpoYRozzMPVnAMyJgNgLyOWNa6o9-bMVdJCN4qk6zlUI9G53MYVUSj8Kt4hxZ5a_7UfIkqIHxjv9_EKza9ef7f0bYppUQSkOCYWuTm_ak1pYTiPN8ViXlWSjMpXTSJAy_psCKhBK4-u8YSsZuPoMxyNs7dVmpQS3wZK4pdewVCyVKvPcevA2_sn7O09A6ufKBdk7jjV31sQO2nSz6R1ltR6Q3MUSRgyKVNJKuAG8JJbUTDocAZdOEr37AX0hMevE7QQacjZ6RuXxjcjblNE9DX8ge-9j0dVPOw9kMbTl31GJw5LLxGXJzdusbCryrvf1VFfn8RW6wBEbn47izJv3BjNCn5Eg8CrNilasyPIr2rdhvW_-X3guAxdkJnRsV-udK-bQBh3qNr6xkvoRwpQcL-fDXCHf0B_h1h54kqvzikXSvi9qZkGGimXreohV_oFCzYkDf8vdkknjwGDk46dM8gorBrdKI_E_saGGDuXvfQckP53Jk_k1ryfJ_HcGg4Xyt2EF8zf8__Mc9f5YB6-vJClFaFB6j1eed8p7VW9cDiChk7FSfPpisfRYpMGy8DZi9xhsm6NexkXGp1MqelzpZdM1Exa8XJRSW74xJSH1MbAk8u4ijwTnrt_L-0bSIYAsv4je576OTNWo2eBOZ_Sy7j0oEygSfVYyXCiBKz8z3iQWDfWn7Sn2CZFlD5QYw5oDqHHAuqbrLuG_P6RTCISV1qo_aGxsu8zyGPRJHyEGpCn8hS8N3rFvrw5S6ckx1NB7npHZsNLjQPiaP-wARZdtD2tNZL6IwPPPh2N0TbSuUEXICOcIScaforr-AOTQmK9xiB7fYrz_GG90uY1dayLSWqkGiGugAenI9jlvEZhv0UwRVwTqQdOrEJBodE35mUEuRHqvNWwgph-UnnTS5VoEz-Dog1gZaQQf4fyPaNxRbOfO7iyZMuoo3ch9cvBtcDK7OvZbDwpzpVas8cNpL0glZ2XxR_3fmkUm_PSnj5OvUsnAyg-Svpvw9yUfIkxr83AGA4okKt7mfqgarqc8rEl9y9S0bASH4mywJQupsNPpQMD0SgXngR3vUyrRlraw2qF1E7YTSyu0qVWxd53SD2BMjieezRDAKQVzGAsb2itByCKF2UCfA8wyfIVZpE0gqxuhh0zvmVxDXeIElX3rFh4rJiGmN8R6y7SuoTx9rvvPmo_ii3wenv,
7,AMZN,3 Millionaire-Maker Artificial Intelligence (AI) Stocks,https://finance.yahoo.com/news/3-millionaire-maker-artificial-intelligence-111500783.html,"According to Grand View Research, the AI market hit a valuation nearing $200 billion in 2023 and is projected to expand at a compound annual growth rate of 37% through 2030. The trajectory will see the industry reach nearly $2 trillion by the end of the decade, suggesting that the market is nowhere near hitting its ceiling and it's not too late to invest in AI. So, here are three millionaire-maker artificial intelligence stocks to buy right now. In its most recent quarter (the fourth quarter of 2024, which ended in January), Nvidia's revenue increased by 265% year over year to $22 billion. This monster growth was primarily thanks to a 409% increase in data center revenue, reflecting a spike in AI GPU sales. Nvidia remains on a promising growth path, and earnings per share (EPS) estimates seem to support its potential. AMD was slightly late to the AI party as Nvidia beat it to the market. However, AMD is investing heavily in the industry and has formed some lucrative partnerships that could take it far in AI over the long term. AMD's earnings have yet to reflect its investment in AI. However, its recent quarterly earnings suggest it's moving in the right direction. In its fourth quarter of 2023, AMD's revenue rose 10% year over year to $6 billion, beating analysts' expectations by about $60 million. The company's AI-focused data center segment posted 38% revenue growth. The company has leading positions in multiple tech areas, including e-commerce, the cloud market, gaming, consumer products, and more. However, all eyes have been on Amazon's AI efforts over the last year. As the operator of the world's biggest cloud service, Amazon Web Services (AWS), the company has the potential to leverage its massive cloud data centers and steer the generative AI market. In 2023, AWS responded to increased demand for AI services by introducing a variety of new tools. Amazon is even using AI to boost its retail site and announced an AI shopping assistant dubbed Rufus ahead of its latest earnings release. Amazon is moving to become a major threat in AI over the long term, but it also has a lucrative retail business that makes its stock too good to pass up. Amazon's earnings are expected to reach nearly $7 per share over the next two fiscal years. In a similar calculation to Nvidia and AMD, multiplying that figure by the retail giant's forward P/E of 43 yields a stock price of $301, which could see its shares increase by 65% by fiscal 2026. As a result, Amazon is a millionaire-maker stock worth considering in 2024. Before you buy stock in Nvidia, consider this: "
8,AMZN,3 Ground Rules I Now Set When Shopping on Amazon,https://finance.yahoo.com/news/3-ground-rules-now-set-110015861.html,"Some people may not get a lot of good use out of their Amazon Prime memberships. But I can say with certainty that the $139 annual fee I pay for the program is not money I'm throwing away. Amazon is one of those sites you might easily browse when you're bored or waiting around for a friend. I used to do the same, but I don't anymore. The reason? There's just too much temptation. As a Prime member, I can order any item for free two-day shipping. A $12 t-shirt here or an $8 hat there may not seem like a big deal. But in the course of a year, those little purchases can add up. So now, I only visit Amazon when there's a specific item I need. And when I do, I don't browse the daily deals. I just stick to the item or items I'm looking for. Similarly, I won't shop on Amazon during special events, like Prime Day, unless there's a reason to. Otherwise, I know I'm likely to be tempted to buy something. I've found that Amazon sells a variety of decent-quality clothing items at low prices. So on occasion, I'll be tempted to purchase a new fleece jacket to go running in, or new socks or pajamas. But as someone who tends to keep her clothing for a really long time, my new rule is that I can't buy clothing on Amazon unless it's to replace something specific in my closet. The way I see it, if I'm not replacing an item I already own, then the item in question is probably something I don't actually need. If there's an item on Amazon I need in a pinch, I may have to order it for two-day delivery, which I get for free as a Prime member. But for non-urgent purchases, my new rule is to always see if the item in question is available via the Subscribe & Save program. The program allows you to set up items to ship to you automatically at different intervals, such as once a month, once every other month, and so forth. And you'll generally snag a discount on the things you're buying if you use Subscribe & Save. So if there's no rush for your new face cream or toothpaste or vitamins, why not save money on them? Shopping on Amazon may hurt your finances if you aren't careful. It pays to do what you can to avoid impulse buys on the site. And it pays to seek out savings where you can, such as looking to the Subscribe & Save program for the things you don't need immediately. If you feel that your Amazon spending has been excessive lately, you may want to implement your own set of rules for shopping on the site. You may find that it does your finances a lot of good. "
